NAME;TYPE;PERIOD;NAMEDETAIL;NAMEORIGIN;LANGRENUS;HEVELIUS;RICCIOLI;WORK;COUNTRY;NATIONLITY;CENTURYN;CENTURYC;BIRTHPLACE;BIRTHDATE;DEATHPLACE;DEATHDATE;FACTS;LONGIN;LONGIC;LATIN;LATIC;QUADRANT;AREA;RUKL;RUKLC;VISCARDY;HATFIELD;WESTFALL;WOOD;LOPAM;LENGTHKM;WIDEKM;LENGTHMI;WIDEMI;HEIGHTM;HEIGHTFE;RAPPORT;PROFIL;GENERAL;SLOPES;WALLS;FLOOR;INTERESTN;INTERESTC;LUNATION;MOONDAYS;MOONDAYM;DIAMINST;THINSTRU;PRINSTRU
DORSA BURNET;Bergrückensystem;Imbrianische (Von -3.85 Mrd. bis -3.2 Mrd. Jahre) ?;faltige Bergrücken von Burnet (Thomas Burnet);(??);Kein Name;Kein Name;Kein Name;Naturwissenschaftler;England;englischer;17;17. Jhd.;?;1635;?;1715;??;-57;57.0° West;27;27.0° Nord;Nord-West;Aristarchus Krater Region;18;Aristarchus;341;;237C;;;200;10;121;6;0;0;0;Unbekannte Höhe. Kann nicht gezeigt werden.;Kleiner, markanter, faltiger Rücken. Am Nord-Ost Rand von Oceanus Procellarum.;;;;1;Wenig interessant oder schwierige Formation;12;5 Tage nach ersterm Viertel;4 Tage nach letztem Viertel;50;50 mm Refraktor;100 mm Refraktor
DORSA CATO;Bergrückensystem;Imbrianische (Von -3.85 Mrd. bis -3.2 Mrd. Jahre) ?;faltige Bergrücken von Caton ( Marcus Porcius Cato oder Caton);(??);Kein Name;Kein Name;Kein Name;Politiker;Rom;römischer;-3;3. Jhd.  BC;Tusculum;234 BC;?;149 BC;Govaneur von Sardinien im Jahre 98 BC.  Autor einer 'Abhandlung über die Landwirtschaft' und einer Geschichte von Rom 'Herkunft'.;47;47.0° Ost;1;1.0° Nord;Nord-Ost;Nord Rand vonMare Fecunditatis;37;Taruntius;231;;131C;;;140;7;85;4;0;0;0;Unbekannte Höhe. Kann nicht gezeigt werden.;Kleiner, markanter, faltiger Rücken, gelegen im Norden von Mare Fecunditatis.;;;;1;Wenig interessant oder schwierige Formation;4;4 Tage nach Neumond;3 Tage nach Vollmond;50;50 mm Refraktor;100 mm Refraktor
DORSA EUCLIDES F;Bergrückensystem;Imbrianische (Von -3.85 Mrd. bis -3.2 Mrd. Jahre) ?;faltige Bergrücken von Euclides F - Euclide;(??);Kein Name;Kein Name;Kein Name;Mathematiker;Griechenland;griechischer;-4;4 . Jhd. BC;?;?;Alexundrie;?;;-34;34.0° West;-5;5.0° Süd;Süd-West;Süd-Ost Teil von Oceanus Procellarum;41;Euclides;219;;;;;0;5;0;3;0;0;0;Unbekannte Höhe. Kann nicht gezeigt werden.;;;;;3;Sehr interessante Formation;10;3 Tage nach ersterm Viertel;2 Tage nach letztem Viertel;50;50 mm Refraktor;100 mm Refraktor
DORSA EWING;Bergrückensystem;Imbrianische (Von -3.85 Mrd. bis -3.2 Mrd. Jahre) ?;faltige Bergrücken von Ewing (William Maurice Ewing);(??);Kein Name;Kein Name;Kein Name;Geologe;U. S. A.;amerikanischer;20;20. Jhd.;Lockney;1906;Galveston;1974;Professor in der University of Columbia. Vordenker der Plattentektonik.;-38;38.0° West;-11;11.0° Süd;Süd-West;Süd-Ost Teil von Oceanus Procellarum;41;Euclides;221;;036C;;;320;15;194;9;0;0;0;Unbekannte Höhe. Kann nicht gezeigt werden.;Verzweigter und kleiner markanter, faltiger Rücken, gelegen im Norden von Oceanus Procellarum und orientiert in Richtung Süd-Ost Nord-West.;;;;2;Ziemlich interessante Formation;10;3 Tage nach ersterm Viertel;2 Tage nach letztem Viertel;50;50 mm Refraktor;100 mm Refraktor
DORSA GEIKIE;Bergrückensystem;Imbrianische (Von -3.85 Mrd. bis -3.2 Mrd. Jahre) ?;faltige Bergrücken von Geikie (Sir Archibald Geikie);(??);Kein Name;Kein Name;Kein Name;Geologe;Schottland;schottisch;19;19. Jhd.;?;1835;?;1924;??;53;53.0° Ost;-3;3.0° Süd;Süd-Ost;Ost Teil von Mare Fecunditatis;48;Messier;231;;124N;;;240;8;145;5;0;0;0;Unbekannte Höhe. Kann nicht gezeigt werden.;sehr markanter, faltiger Rücken, gelegen in der Nähe des Zentrums von Mare Fecunditatis und orientiert in Richtung Nord - Süd.;Zerfurcht von einigen kleinen Kratern in seinem Südteil.;;;2;Ziemlich interessante Formation;4;4 Tage nach Neumond;3 Tage nach Vollmond;50;50 mm Refraktor;100 mm Refraktor
DORSA HARKER;Bergrückensystem;Imbrianische (Von -3.85 Mrd. bis -3.2 Mrd. Jahre) ?;faltige Bergrücken von Harker (Alfred Harker);(??);Kein Name;Kein Name;Kein Name;Geologe;Großbritannien;britischer;20;20. Jhd.;?;1859;?;1939;??;64;64.0° Ost;14;14.0° Nord;Nord-Ost;Mond Ost-Nord-Ost Bogen;27;Plutarch;262;;112N;;;200;11;121;7;0;0;0;Unbekannte Höhe. Kann nicht gezeigt werden.;Kleiner,  markanter, faltiger Rücken, gelegen in der Kante von Mare Crisium.;;;;2;Ziemlich interessante Formation;3;3 Tage nach Neumond;2 Tage nach Vollmond;50;50 mm Refraktor;100 mm Refraktor
DORSA LISTER;Bergrückensystem;Imbrianische (Von -3.85 Mrd. bis -3.2 Mrd. Jahre) ?;faltige Bergrücken von Lister (Martin Lister);(??);Kein Name;Kein Name;Kein Name;Geologe;England;englischer;17;17. Jhd.;Radclive;1638;Epsom;1712;Spezialist für Fossilien.  Entdecker des Aussterbens einiger Arten.;22;22.0° Ost;19;19.0° Nord;Nord-Ost;Süd-Ost Teil von Mare Serenitatis;24;Bessel;317;;148C 154C;;;290;20;176;12;0;0;0;Unbekannte Höhe. Kann nicht gezeigt werden.;System sehr markanter, faltiger Rücken mit Kreisbogenform, gelegen in Mare Serenitatis. Verbunden mit Dorsa Smirnov.;;;;3;Sehr interessante Formation;5;5 Tage nach Neumond;4 Tage nach Vollmond;30;10x Doppelfernrohr;50 mm Refraktor
DORSA MAWSON;Bergrückensystem;Imbrianische (Von -3.85 Mrd. bis -3.2 Mrd. Jahre) ?;faltige Bergrücken von Mawson (Sir Douglas Mawson);(??);Kein Name;Kein Name;Kein Name;Entdecker;Australien;australischer;20;20. Jhd.;Frizinghall;1882;Adelaïde;1958;;53;53.0° Ost;-7;7.0° Süd;Süd-Ost;Ost Teil von Mare Fecunditatis;48;Messier;191;3g6 / 4g1;124N;;;180;22;109;13;0;0;0;Unbekannte Höhe. Kann nicht gezeigt werden.;Großer, faltiger Rücken, orientiert in Richtung Süd-West Nord-Ost.;Door Goclenius UA und AB an seinem äußersten Südrand gelegen und Langrenus FE und FF ist an seinem äußersten Nordrand gelegen.;;;2;Ziemlich interessante Formation;4;4 Tage nach Neumond;3 Tage nach Vollmond;30;10x Doppelfernrohr;50 mm Refraktor
DORSA RUBEY;Bergrückensystem;Imbrianische (Von -3.85 Mrd. bis -3.2 Mrd. Jahre) ?;faltige Bergrücken von Rubey (William Maldey Rubey);(??);Kein Name;Kein Name;Kein Name;Geologe;U. S. A.;amerikanischer;20;20. Jhd.;?;1898;?;1974;??;-42;42.0° West;-10;10.0° Süd;Süd-West;Süd-West Teil von Oceanus Procellarum;40;Flamsteed;223;;;;;100;8;61;5;0;0;0;Unbekannte Höhe. Kann nicht gezeigt werden.;Verzweigter und kleiner, markanter, faltiger Rücken, orientiert in Richtung Nord - Süd, endet zum Süden hin im Gebiet von Letronne und, angrenzend an die Mitte von Letronne A.;;;;2;Ziemlich interessante Formation;10;3 Tage nach ersterm Viertel;2 Tage nach letztem Viertel;50;50 mm Refraktor;100 mm Refraktor
DORSA SMIRNOV;Bergrückensystem;Imbrianische (Von -3.85 Mrd. bis -3.2 Mrd. Jahre) ?;faltige Bergrücken von Smirnov (Serguej S. Smirnov);(??);Kein Name;Kein Name;Kein Name;Naturwissenschaftler;U. S. S. R.;sowjetischer;20;20. Jhd.;?;1895;?;1947;??;25;25.0° Ost;25;25.0° Nord;Nord-Ost;Süd-Ost Teil von Mare Serenitatis;24;Bessel;317;;334N 148N 154N/C;;;130;20;79;12;0;0;0;Unbekannte Höhe. Kann nicht gezeigt werden.;System von sehr markanten, faltigen Rücken, orientiert in Richtung Nord-Süd. Höchste Erhebung von Mare Serenitatis.;Gelegen im Norden von Mare Serenitatis.  Trägt den kleinen Krater Very an seinem Zentralteil.;;;3;Sehr interessante Formation;5;5 Tage nach Neumond;4 Tage nach Vollmond;30;10x Doppelfernrohr;50 mm Refraktor
DORSA STILLE;Bergrückensystem;Imbrianische (Von -3.85 Mrd. bis -3.2 Mrd. Jahre) ?;faltige Bergrücken von Stille (Hans Stille);(??);Kein Name;Kein Name;Kein Name;Naturwissenschaftler;Deutschland;deutscher;20;20. Jhd.;?;1876;?;1966;??;-19;19.0° West;27;27.0° Nord;Nord-West;Süd Teil von Mare Imbrium;20;Pytheas;336;3g7 / 4g2;;;;80;3;48;2;0;0;0;Unbekannte Höhe. Kann nicht gezeigt werden.;System von kleinen, markanten, faltiger Rücken im Mare Imbrium, im Nord-Osten von Lambert.;;;;1;Wenig interessant oder schwierige Formation;9;2 Tage nach ersterm Viertel;1 Tag nach Letztes Viertel;100;100 mm Reflektor;200 mm Reflektor
DORSA TETYAEV;Bergrückensystem;Imbrianische (Von -3.85 Mrd. bis -3.2 Mrd. Jahre) ?;faltige Bergrücken von Tetjajew (Michail M. Tetjajew);(??);Kein Name;Kein Name;Kein Name;Geologe;U. S. S. R.;sowjetischer;20;20. Jhd.;?;1882;?;1956;??;65;65.0° Ost;19;19.0° Nord;Nord-Ost;Mond Ost-Nord-Ost Bogen;27;Plutarch;262;;112N;;;150;11;91;7;0;0;0;Unbekannte Höhe. Kann nicht gezeigt werden.;Kleiner, markanter, faltiger Rücken, gelegen in der Nord-Ost Kante von Mare Crisium.;;;;2;Ziemlich interessante Formation;3;3 Tage nach Neumond;2 Tage nach Vollmond;50;50 mm Refraktor;100 mm Refraktor
DORSA WHISTON;Bergrückensystem;Imbrianische (Von -3.85 Mrd. bis -3.2 Mrd. Jahre) ?;faltige Bergrücken von Whiston (William Whiston);(??);Kein Name;Kein Name;Kein Name;Mathematiker;Großbritannien;britischer;18;18. Jhd.;?;1667;?;1752;??;-57;57.0° West;30;30.0° Nord;Nord-West;Mond Nord-West Bogen;8;Rümker;361;;;;;120;2;73;1;0;0;0;Unbekannte Höhe. Kann nicht gezeigt werden.;Kleiner, markanter, faltiger Rücken, orientiert in Richtung Nord Süd.;;;;1;Wenig interessant oder schwierige Formation;12;5 Tage nach ersterm Viertel;4 Tage nach letztem Viertel;150;150 mm Reflektor;300 mm Reflektor
DORSUM ARDUINO;Faltiger Bergrücken;Imbrianische (Von -3.85 Mrd. bis -3.2 Mrd. Jahre) ?;Faltiger Rücken von Arduino (Giovanni Arduino);(??);Kein Name;Kein Name;Kein Name;Mineraloge und Chemiker;Italien;italienischer;18;18. Jhd.;Caprino;1713;Venice;1795;Vordenker der Gesteinsschichten. Arbeiten über die Inbetriebnahme von Bergwerken.;-36;36.0° West;26;26.0° Nord;Nord-West;Region zwischen Oceanus Procellarum und Mare Imbrium;19;Brayley;337;;;;;110;9;67;5;0;0;0;Unbekannte Höhe. Kann nicht gezeigt werden.;Kleiner, markanter, faltiger Rücken, orientiert in Richtung Nord Süd.;;;;1;Wenig interessant oder schwierige Formation;10;3 Tage nach ersterm Viertel;2 Tage nach letztem Viertel;50;50 mm Refraktor;100 mm Refraktor
DORSUM AZARA;Faltiger Bergrücken;Imbrianische (Von -3.85 Mrd. bis -3.2 Mrd. Jahre) ?;Faltiger Rücken von Azara ex Serpentine Rücken (Felix de Azara);(??);Kein Name;Kein Name;Kein Name;Naturwissenschaftler;Spanien;spanischer;18;18. Jhd.;?;1746;?;1811;;20;20.0° Ost;26;26.0° Nord;Nord-Ost;Süd-Ost Teil von Mare Serenitatis;24;Bessel;316;;161N/C;;;110;7;67;4;150;500;0.0014;Zu flach. Kann nicht gezeigt werden.;Kleiner, markanter, faltiger Rücken, gelegen im Zentrum von Mare Serenitatis und, angrenzend an den Krater Sarabhai.;;;;1;Wenig interessant oder schwierige Formation;5;5 Tage nach Neumond;4 Tage nach Vollmond;50;50 mm Refraktor;100 mm Refraktor
DORSUM BUCHER;Faltiger Bergrücken;Imbrianische (Von -3.85 Mrd. bis -3.2 Mrd. Jahre) ?;Faltiger Rücken von Bucher (W. H. Bucher);(??);Kein Name;Kein Name;Kein Name;Geophysiker;Schweiz;schweizer;20;20. Jhd.;?;1889;?;1965;"??";-39;39.0° West;31;31.0° Nord;Nord-West;Nord Teil von Oceanus Procellarum;9;Mairan;359;;;;;90;12;55;7;0;0;0;Unbekannte Höhe. Kann nicht gezeigt werden.;Kleiner, markanter, faltiger Rücken, orientiert in Richtung Nord Süd.;;;;1;Wenig interessant oder schwierige Formation;10;3 Tage nach ersterm Viertel;2 Tage nach letztem Viertel;50;50 mm Refraktor;100 mm Refraktor
DORSUM BUCKLAND;Faltiger Bergrücken;Imbrianische (Von -3.85 Mrd. bis -3.2 Mrd. Jahre) ?;Faltiger Rücken von Buckland (William Buckland);(??);Kein Name;Kein Name;Kein Name;Naturwissenschaftler;Großbritannien;britischer;19;19. Jhd.;?;1784;?;1856;??;12;12.0° Ost;21;21.0° Nord;Nord-Ost;Süd-West Teil von Mare Serenitatis;23;Linné;319;;167N;;;150;8;91;5;0;0;0;Unbekannte Höhe. Kann nicht gezeigt werden.;Sehr markanter, faltiger Rücken, orientiert in Richtung Süd-Ost Nord-West und gelegen am  Südabhang von Mare Serenitatis ebenso von Montes Haemus.;;;;2;Ziemlich interessante Formation;6;6 Tage nach Neumond;5 Tage nach Vollmond;50;50 mm Refraktor;100 mm Refraktor
DORSUM CAYEUX;Faltiger Bergrücken;Imbrianische (Von -3.85 Mrd. bis -3.2 Mrd. Jahre) ?;Faltiger Rücken von Cayeux (Lucien Cayeux);(??);Kein Name;Kein Name;Kein Name;Geologe;Frankreich;französischer;20;20. Jhd.;Semousies;1864;Mauves sur Loire;1944;Arbeiten über Gesteinskunde der Sedimentgesteine.  Mitglied der französischen Akademie der Wissenschaften im Jahre 1928.;51;51.0° Ost;1;1.0° Nord;Nord-Ost;Nord Rand of Mare Fecunditatis;37;Taruntius;231;;124C;;;130;9;79;5;0;0;0;Unbekannte Höhe. Kann nicht gezeigt werden.;Faltiger Rücken, ziemlich markant, gelegen im Norden von Mare Fecunditatis. Trägt den kleinen Krater Taruntius P und ist verbunden mit Dorsum Geikie zum Süden hin.;;;;2;Ziemlich interessante Formation;4;4 Tage nach Neumond;3 Tage nach Vollmond;50;50 mm Refraktor;100 mm Refraktor
DORSUM CUSHMAN;Faltiger Bergrücken;Imbrianische (Von -3.85 Mrd. bis -3.2 Mrd. Jahre) ?;Faltiger Rücken von Cushman (J. A. Cushman);(??);Kein Name;Kein Name;Kein Name;Palaeontologe;U. S. A.;amerikanischer;20;20. Jhd.;?;1881;?;1949;Spezialistfür Mikropaleontologie.;49;49.0° Ost;1;1.0° Nord;Nord-Ost;Nord Rand von Mare Fecunditatis;37;Taruntius;231;;131C;;;80;6;48;4;0;0;0;Unbekannte Höhe. Kann nicht gezeigt werden.;Gelegen im Norden von Mare Fecunditatis. Klein, erhaben.;;;;1;Wenig interessant oder schwierige Formation;4;4 Tage nach Neumond;3 Tage nach Vollmond;50;50 mm Refraktor;100 mm Refraktor
DORSUM GAST;Faltiger Bergrücken;Imbrianische (Von -3.85 Mrd. bis -3.2 Mrd. Jahre) ?;Faltiger Rücken von Gast (Paul Werner Gast);(??);Kein Name;Kein Name;Kein Name;Geologe;U. S. A.;amerikanischer;20;20. Jhd.;?;1930;?;1973;??;9;9.0° Ost;24;24.0° Nord;Nord-Ost;Süd-West Teil von Mare Serenitatis;23;Linné;319;;167N;;;60;6;36;4;0;0;0;Unbekannte Höhe. Kann nicht gezeigt werden.;Kleiner, markanter, faltiger Rücken, orientiert in Richtung Nord Süd und gelegen an der Böschung von Mare Serenitatis.;Trägt den kleinen Krater Aratus D und einen kleinen zweiten Krater in seinem Mittelteil.;;;2;Ziemlich interessante Formation;6;6 Tage nach Neumond;5 Tage nach Vollmond;50;50 mm Refraktor;100 mm Refraktor
DORSUM GRABAU;Faltiger Bergrücken;Imbrianische (Von -3.85 Mrd. bis -3.2 Mrd. Jahre) ?;Faltiger Rücken von Grabau (Amadeus W. Grabau);(??);Kein Name;Kein Name;Kein Name;Geophysiker;U. S. A.;amerikanischer;20;20. Jhd.;?;1870;?;1946;??;-14;14.0° West;30;30.0° Nord;Nord-West;Zentralteil von Mare Imbrium;11;Le Verrier;336;;191N;;;120;22;73;13;0;0;0;Unbekannte Höhe. Kann nicht gezeigt werden.;Ziemlich markanter, faltiger Rücken, orientiert in Richtung West Ost.;;;;2;Ziemlich interessante Formation;8;1 Tag nach Erstes Viertel;Letztes Viertel;30;10x Doppelfernrohr;50 mm Refraktor
DORSUM GUETTARD;Faltiger Bergrücken;Imbrianische (Von -3.85 Mrd. bis -3.2 Mrd. Jahre) ?;Faltiger Rücken von Guettard (Jean-Etienne Guettard);(??);Kein Name;Kein Name;Kein Name;Geologe und Naturwissenschaftler;Frankreich;französischer;18;18. Jhd.;Etampes;1715;Paris;1786;Entdecker der vulkanischen Entstehung der Berge der Auvergne. Entdeckung von Kaolin im Jahre 1765. Mitglied der französischen Akademie der Wissenschaften im Jahre 1743.;-18;18.0° West;-10;10.0° Süd;Süd-West;Süd-östlich von Oceanus Procellarum Region;42;Fra Mauro;216;;;;;40;6;24;4;0;0;0;Unbekannte Höhe. Kann nicht gezeigt werden.;Kleiner, markanter, faltiger Rücken, gelegen am West Abhang von Bonpland.;;;;1;Wenig interessant oder schwierige Formation;8;1 Tag nach Erstes Viertel;Letztes Viertel;50;50 mm Refraktor;100 mm Refraktor
DORSUM HEIM;Faltiger Bergrücken;Imbrianische (Von -3.85 Mrd. bis -3.2 Mrd. Jahre) ?;Faltiger Rücken von Heim (Albert Heim);(??);Kein Name;Kein Name;Kein Name;Geophysiker;Schweiz;schweizer;19;19. Jhd.;Zürich;1849;Zürich;1937;Entdecker des Mechanismus der Gebirgsfaltung. Zahlreiche Arbeiten über die Alpen.;-29;29.0° West;31;31.0° Nord;Nord-West;Nord-West Teil von Mare Imbrium;10;Sinus Iridum;358;;201N 205N;;;130;13;79;8;0;0;0;Unbekannte Höhe. Kann nicht gezeigt werden.;Sehr markanter und langer, faltiger Rücken  in Kreisbogenform und orientiert in Richtung  Süd-Ost Nord-West. Trägt den Krater C. Herschel.;;;;3;Sehr interessante Formation;9;2 Tage nach ersterm Viertel;1 Tag nach Letztes Viertel;50;50 mm Refraktor;100 mm Refraktor
DORSUM HIGAZY;Faltiger Bergrücken;Imbrianische (Von -3.85 Mrd. bis -3.2 Mrd. Jahre) ?;Faltiger Rücken von Higazy (Riad Higazy);(??);Kein Name;Kein Name;Kein Name;Naturwissenschaftler;Ägypten;ägyptischer;20;20. Jhd.;?;1919;?;1967;??;-17;17.0° West;28;28.0° Nord;Nord-West;Süd-Ost Teil von Mare Imbrium;21;Timocharis;336;;191N;;;60;9;36;5;0;0;0;Unbekannte Höhe. Kann nicht gezeigt werden.;Kleiner, markanter, faltiger Rücken, orientiert in Richtung Süd-West Nord-Ost, gelegen in Mare Imbrium zum Nord-Osten von Timocharis hin .;ein isolierter Berg im Norden seines äußersten Südrandes.;;;2;Ziemlich interessante Formation;8;1 Tag nach Erstes Viertel;Letztes Viertel;50;50 mm Refraktor;100 mm Refraktor
DORSUM NICOL;Faltiger Bergrücken;Imbrianische (Von -3.85 Mrd. bis -3.2 Mrd. Jahre) ?;Faltiger Rücken von Nicol (William Nicol);(??);Kein Name;Kein Name;Kein Name;Physiker;Schottland;schottisch;19;19. Jhd.;?;1768;Edimbourg;1851;Erfinder des Polarisationsprismas mit Feldspat im Jahre 1828.;23;23.0° Ost;18;18.0° Nord;Nord-Ost;Süd-Ost Teil von Mare Serenitatis;24;Bessel;284;;154C;;;50;5;30;3;0;0;0;Unbekannte Höhe. Kann nicht gezeigt werden.;Kleiner, markanter, faltiger Rücken, orientiert in Richtung Nord  Süd, gelegen im Norden von Mare Serenitatis und verbindet Dorsa Lister mit Rimae Plinius.;;;;2;Ziemlich interessante Formation;5;5 Tage nach Neumond;4 Tage nach Vollmond;50;50 mm Refraktor;100 mm Refraktor
DORSUM NIGGLI;Faltiger Bergrücken;Imbrianische (Von -3.85 Mrd. bis -3.2 Mrd. Jahre) ?;Faltiger Rücken von Niggli (Paul Niggli);(??);Kein Name;Kein Name;Kein Name;Naturwissenschaftler;Schweiz;schweizer;20;20. Jhd.;?;1888;?;1953;??;-52;52.0° West;29;29.0° Nord;Nord-West;Aristarchus Krater Region;18;Aristarchus;341;;;;;50;5;30;3;0;0;0;Unbekannte Höhe. Kann nicht gezeigt werden.;Kleiner, markanter, faltiger Rücken und senkrecht zu Montes Agricola.;;;;1;Wenig interessant oder schwierige Formation;11;4 Tage nach ersterm Viertel;3 Tage nach letztem Viertel;50;50 mm Refraktor;100 mm Refraktor
DORSUM OPPEL;Faltiger Bergrücken;Imbrianische (Von -3.85 Mrd. bis -3.2 Mrd. Jahre) ?;Faltiger Rücken von Oppel (Albert Oppel);(??);Kein Name;Kein Name;Kein Name;Palaeontologe;Deutschland;deutscher;19;19. Jhd.;?;1831;?;1865;??;52;52.0° Ost;19;19.0° Nord;Nord-Ost;Nord-West Rand of Mare Crisium;26;Cleomedes;263;;124N;;;300;7;182;4;0;0;0;Unbekannte Höhe. Kann nicht gezeigt werden.;Kleiner, markanter, faltiger Rücken in Kreisbogenform. Ausfransung der Westwand von Mare Crisium.;;;;2;Ziemlich interessante Formation;4;4 Tage nach Neumond;3 Tage nach Vollmond;50;50 mm Refraktor;100 mm Refraktor
DORSUM OWEN;Faltiger Bergrücken;Imbrianische (Von -3.85 Mrd. bis -3.2 Mrd. Jahre) ?;Faltiger Rücken von Owen (George Owen);(??);Kein Name;Kein Name;Kein Name;Naturwissenschaftler;Großbritannien;britischer;16;16. Jhd.;?;1552;?;1613;??;11;11.0° Ost;25;25.0° Nord;Nord-Ost;Süd-West Teil von Mare Serenitatis;23;Linné;319;;167N;;;50;9;30;5;0;0;0;Unbekannte Höhe. Kann nicht gezeigt werden.;Sehr markanter, faltiger Rücken, orientiert in Richtung Nord Süd und gelegen in Mare Serenitatis, im Norden vom Krater Krishna.;;;;2;Ziemlich interessante Formation;6;6 Tage nach Neumond;5 Tage nach Vollmond;50;50 mm Refraktor;100 mm Refraktor
DORSUM SCILLA;Faltiger Bergrücken;Imbrianische (Von -3.85 Mrd. bis -3.2 Mrd. Jahre) ?;Faltiger Rücken von Scilla (Agostino Scilla);(??);Kein Name;Kein Name;Kein Name;Geologe;Italien;italienischer;17;17. Jhd.;?;1639;?;1700;??;-60;60.0° West;32;32.0° Nord;Nord-West;Mond Nord-West Bogen;8;Rümker;361;;237C;;;120;2;73;1;0;0;0;Unbekannte Höhe. Kann nicht gezeigt werden.;Kleiner, markanter, faltiger Rücken orientiert Nord Süd.;;;;1;Wenig interessant oder schwierige Formation;12;5 Tage nach ersterm Viertel;4 Tage nach letztem Viertel;150;150 mm Reflektor;300 mm Reflektor
DORSUM TERMIER;Faltiger Bergrücken;Imbrianische (Von -3.85 Mrd. bis -3.2 Mrd. Jahre) ?;Faltiger Rücken von Termier (Pierre Marie Termier);(??);Kein Name;Kein Name;Kein Name;Geologe;Frankreich;französischer;20;20. Jhd.;Lyon;1859;Grenoble;1930;Mitglied der französischen Akademie der Wissenschaften im Jahre 1909.  Direktor des Geologischen Kartendienstes von Frankreich im Jahre 1911. Autor vieler Arbeiten und Publikationen.;58;58.0° Ost;11;11.0° Nord;Nord-Ost;Mond Ost Bogen;38;Neper;263;;119C;;;90;3;55;2;0;0;0;Unbekannte Höhe. Kann nicht gezeigt werden.;Kleiner, markanter, faltiger Rücken, gelegen im Zentrum von Mare Crisium.;;;;1;Wenig interessant oder schwierige Formation;3;3 Tage nach Neumond;2 Tage nach Vollmond;100;100 mm Reflektor;200 mm Reflektor
DORSUM VON COTTA;Faltiger Bergrücken;Imbrianische (Von -3.85 Mrd. bis -3.2 Mrd. Jahre) ?;Faltiger Rücken von Cotta (Carl Bernard von Cott;(??);Kein Name;Kein Name;Kein Name;Naturwissenschaftler;Deutschland;deutscher;19;19. Jhd.;?;1808;?;1879;??;12;12.0° Ost;24;24.0° Nord;Nord-Ost;Süd-West Teil von Mare Serenitatis;23;Linné;319;;167N;;;220;7;133;4;0;0;0;Unbekannte Höhe. Kann nicht gezeigt werden.;Langer und kleiner, markanter, faltiger Rücken, orientiert in Richtung Nord Süd und gelegen in Mare Serenitatis.;Zusammenhängendes Bergland ähnlich Dorsum Buckland seinem Südteil.;;;2;Ziemlich interessante Formation;6;6 Tage nach Neumond;5 Tage nach Vollmond;50;50 mm Refraktor;100 mm Refraktor
DORSUM ZIRKEL;Faltiger Bergrücken;Imbrianische (Von -3.85 Mrd. bis -3.2 Mrd. Jahre) ?;Faltiger Rücken von Zirkel (Ferdinund Zirkel);(??);Kein Name;Kein Name;Kein Name;Geologe;Deutschland;deutscher;19;19. Jhd.;?;1838;?;1912;??;-24;24.0° West;29;29.0° Nord;Nord-West;Süd Teil von Mare Imbrium;20;Pytheas;336;;024N 029N 201N 205N;;;210;8;127;5;0;0;0;Unbekannte Höhe. Kann nicht gezeigt werden.;Sehr markanter, faltiger Rücken, orientiert in Richtung Süd-Ost Nord-West und gelegen in Mare Imbrium, zum von Lambert Nord-Westen hin.;Abhänge, angrenzend an den kleinen Krater Lambert A und B zum Süden hin.;;;2;Ziemlich interessante Formation;9;2 Tage nach ersterm Viertel;1 Tag nach Letztes Viertel;50;50 mm Refraktor;100 mm Refraktor
DOVE;Krater;Pre-Imbrianische (Von -4.55 Mrd. bis -3.85 Mrd. Jahre) ?;Heinrich W. Dove;Schmidt (1878);Kein Name;Kein Name;Kein Name;Physiker;Deutschland;deutscher;19;19. Jhd.;?;1803;?;1879;Spezialist für Elektrizität und Meteorlogie.;31;31.0° Ost;-46.7;46.7° Süd;Süd-Ost;Rupes Altai Süd Region;67;Rabbi Levi;35;;328S 334S 343S 131S 135S 143S;;;29;29;18;18;1600;4800;0.0533;A_______________________________________A;Beschädigte, kreisförmige Formation.;Kleine, steile Stelle, anstoßend an Dove C zum Süd-Westen hin und an einen Kleinen Krater zum Süd-Osten hin und zum Nord-Osten hin.;Kleine, hohe Wände.;Kleine, ausgedehnte und flache Ebene mit Kammlinie.;2;Ziemlich interessante Formation;5;5 Tage nach Neumond;4 Tage nach Vollmond;30;10x Doppelfernrohr;50 mm Refraktor
DRAPER;Kleiner Krater;Eratosthenianische (Von -3.2 Mrd. bis -1.1 Mrd. Jahre) ?;Henry Draper;Krieger / König (1912);Kein Name;Kein Name;Kein Name;Astronom;U. S. A.;amerikanischer;19;19. Jhd.;Prince Edward County;1837;New York;1882;Vorreiter in der Astrophotographie und the Spektroskopie. Autor des 'Henry Draper Catalogue', welcher 240 000 Sternspektren enthält.  Erfinder der Basis der Sternklassifikation.;-21.7;21.7° West;17.6;17.6° Nord;Nord-West;Süd Teil von Mare Imbrium;20;Pytheas;301;14b5 / 16g4 / 16g5;024C 029C 191N/C 201N;;;8.8;8.8;5;5;1740;5300;0.1977;A_________A;Isolierte, kreisförmige Formation mit Schüsselform, gelegen am äußersten Rand eines faltigen Rückens, verbunden mit Pytheas. Bildet ein Paar mit  Draper C.;Kleine, steile Stelle.;Kleine, hohe Wände.;Rundliche Ebene.;2;Ziemlich interessante Formation;9;2 Tage nach ersterm Viertel;1 Tag nach Letztes Viertel;50;50 mm Refraktor;100 mm Refraktor
DRAPER C;Kleiner Krater;Eratosthenianische (Von -3.2 Mrd. bis -1.1 Mrd. Jahre) ?;Draper C - Henry Draper;(??);Kein Name;Kein Name;Kein Name;Astronom;U. S. A.;amerikanischer;19;19. Jhd.;Prince Edward County;1837;New York;1882;Vorreiter in der Astrophotographie und the Spektroskopie. Autor des 'Henry Draper Catalogue', welcher 240 000 Sternspektren enthält.  Erfinder der Basis der Sternklassifikation.;-21.5;21.5° West;17.2;17.2° Nord;Nord-West;Süd Teil von Mare Imbrium;20;Pytheas;301;5e5 / 5e6;;;;7.8;7.8;5;5;1610;4900;0.2064;A_________A;Isolierte, kreisförmige Formation mit Schüsselform. Bildet ein Paar mit Draper.;Kleine, steile Stelle, angrenzend an einen kleinen Krater zum Süd-Westen hin.;Kleine, hohe Wände.;Rundliche Ebene.;2;Ziemlich interessante Formation;9;2 Tage nach ersterm Viertel;1 Tag nach Letztes Viertel;50;50 mm Refraktor;100 mm Refraktor
DREBBEL;Krater;Imbrianische (Von -3.85 Mrd. bis -3.2 Mrd. Jahre) ?;Cornelis Drebbel;Mädler (1837);Kein Name;Kein Name;Kein Name;Physiker und Ingenieur;Niederlande;niederländischer;17;17. Jhd.;Alkmaar;1572;Leyde;1634;Pionier bei der Realisierung des ersten Mikroskops.  Konstrukteur des ersten Unterseebootes im Jahre 1624.;-49;49.0° West;-40.9;40.9° Süd;Süd-West;Schickard Krater Region;62;Schickard;144;;048S 055S 061S 067C/S 075S 213S 225S;;;29;24;18;15;3500;10600;0.1167;A_________________A;Isolierte Formation mit länglicher Form.;Ziemlich steile Stelle, angrenzend an an einige kleine Krater zum Süden hin.;Sehr hohe Wände.;Längliche, flache Ebene, gefüllt mit Lava.;3;Sehr interessante Formation;11;4 Tage nach ersterm Viertel;3 Tage nach letztem Viertel;30;10x Doppelfernrohr;50 mm Refraktor
