NAME;TYPE;PERIOD;NAMEDETAIL;NAMEORIGIN;LANGRENUS;HEVELIUS;RICCIOLI;WORK;COUNTRY;NATIONLITY;CENTURYN;CENTURYC;BIRTHPLACE;BIRTHDATE;DEATHPLACE;DEATHDATE;FACTS;LONGIN;LONGIC;LATIN;LATIC;QUADRANT;AREA;RUKL;RUKLC;VISCARDY;HATFIELD;WESTFALL;WOOD;LOPAM;LENGTHKM;WIDEKM;LENGTHMI;WIDEMI;HEIGHTM;HEIGHTFE;RAPPORT;PROFIL;GENERAL;SLOPES;WALLS;FLOOR;INTERESTN;INTERESTC;LUNATION;MOONDAYS;MOONDAYM;DIAMINST;THINSTRU;PRINSTRU
LAGRANGE;Umwandete Fläche;Pre-Nectarianische (Von -4.55 Mrd. bis -3.92 Mrd. Jahre);Comte Louis de Lagrange;Mädler (1837);Kein Name;Kein Name;Kein Name;Mathematiker;Frankreich;französischer;18;18. Jhd.;Turin;1736;Paris;1813;Autor der 'Analytischen Mechanik' im Jahre 1788 und der 'Analytischen Funktionstheorie' im Jahre 1797.;-72;72.0° West;-33.2;33.2° Süd;Süd-West;Mond Süd-West Bogen;61;Piazzi;142;11g1 / 12g8;075C/S 080C/S 237S 247S;;;156;156;97;97;0;0;0.0169;Zu flach. Kann nicht gezeigt werden.;Kreisförmige Formation, Umgrenzung stark abgebaut.;Ziemlich steile Stelle, gerillt von Kratern und, angrenzend an Piazzi zum Süd-Westen hin.;Hohe zerklüftete Wände, angrenzend an viele Krater, wie Lagrange K zum Nord-Osten hin.;Flache Ebene zum Norden hin und zerklüftet zum Süden hin. Berg länglich zum Zentrum hin.;3;Sehr interessante Formation;13;6 Tage nach ersterm Viertel;5 Tage nach letztem Viertel;5;Bloses Auge;10x Doppelfernrohr
LALANDE;Krater;Copernicianische (Von -1.1 Mrd. bis heute);Joseph Jérôme LeFrançois de Lalande;Lohrmann (1824);Rosetti;Mons Micale;Kein Name;Astronom;Frankreich;französischer;18;18. Jhd.;Bourg en Bresse;1732;Paris;1807;Messung der Mondentfernung im Jahre 1751. Arbeiten über Planeten.  Herausgeber der 'Wissenschaft der Zeit' im Jahre 1760. Mitglied der französischen Akademie der Wissenschaften im Jahre 1753. Direktor des Observatoriums von Paris im Jahre 1795. Autor der 'Französischen Himmelsgeschichte'.;-8.6;8.6° West;-4.4;4.4° Süd;Süd-West;westlich von Ptolemaeus Krater Region;43;Lalande;215;5c1 / 9a6 / 13h7;009C 018C 179C 183C;;;24;24;15;15;2590;7800;0.1079;A__________________A;Isolierte, kreisförmige Formation.;Steile Stelle, angrenzend eine Kette von Bergen zum Süd-Westen hin und Lalande B zum Norden hin.;Hohe Wände mit Terrassen.;Kleine, ausgedehnte und flache Ebene. Kleines Zentralrelief. Radiations.;3;Sehr interessante Formation;8;1 Tag nach Erstes Viertel;Letztes Viertel;30;10x Doppelfernrohr;50 mm Refraktor
LALANDE A;Krater;Eratosthenianische (Von -3.2 Mrd. bis -1.1 Mrd. Jahre) ?;Lalande A - Joseph Jérôme LeFrançois de Lalande;(??);Kein Name;Kein Name;Kein Name;Astronom;Frankreich;französischer;18;18. Jhd.;Bourg en Bresse;1732;Paris;1807;Messung der Mondentfernung im Jahre 1751. Arbeiten über Planeten.  Herausgeber der 'Wissenschaft der Zeit' im Jahre 1760. Mitglied der französischen Akademie der Wissenschaften im Jahre 1753. Direktor des Observatoriums von Paris im Jahre 1795. Autor der 'Französischen Himmelsgeschichte'.;-9.6;9.6° West;-6.7;6.7° Süd;Süd-West;westlich von Ptolemaeus Krater Region;43;Lalande;243;;;;;13.2;13.2;8;8;2600;7900;0.197;A_________A;Isolierte, kreisförmige Formation mit Schüsselform.;Ziemlich steile Stelle.;Hohe Wände.;Rundliche Ebene.;2;Ziemlich interessante Formation;8;1 Tag nach Erstes Viertel;Letztes Viertel;50;50 mm Refraktor;100 mm Refraktor
LALLEMAND;Krater;Entstehungsperiode nicht gefunden;undré Lallemund (ehem. Kopff A);(??);Kein Name;Kein Name;Kein Name;Astronom;Frankreich;französischer;20;20. Jhd.;Cirey les Pontailler;1904;Paris;1978;Erfinder der elektronischen Kamera im Jahre 1936. Professor des College von Frankreich und Mitglied der französischen Akademie der Wissenschaften im Jahre 1961.;-84.1;84.1° West;-14.3;14.3° Süd;Süd-West;Mond West Bogen;39;Grimaldi;224;;Q3W;;;18;18;11;11;0;0;0;Unbekannte Höhe. Kann nicht gezeigt werden.;Isolierte, kreisförmige Formation mit Schüsselform, gelegen in der Liberationszone.;Ziemlich steile Stelle.;Kleine, hohe Wände.;Rundliche Ebene.;2;Ziemlich interessante Formation;14;Vollmond;6 Tage nach letztem Viertel;50;50 mm Refraktor;100 mm Refraktor
LAMARCK;Krater;Pre-Nectarianische (Von -4.55 Mrd. bis -3.92 Mrd. Jahre);Jean Baptiste de Monet Chevalier de Lamarck;Arthur / Whitaker (1963);Kein Name;Kein Name;Kein Name;Naturwissenschaftler;Frankreich;französischer;18;18. Jhd.;Bazentin;1744;Paris;1829;Professor des Museums für Naturgeschichte im Jahre 1793. Mitglied der französischen Akademie der Wissenschaften im Jahre 1795. Autor der Theorie der Anpassung der Arten, 'Lamarckismus' genannt.;-69.8;69.8° West;-22.9;22.9° Süd;Süd-West;Mond West-Süd-Westbogen;50;Darwin;184;11g3;075C 080C 247C\S;;;115;115;70;70;0;0;0;Unbekannte Höhe. Kann nicht gezeigt werden.;Abgewrackte, kreisförmige Formation.;Ziemlich steile Stelle, angrenzend an Byrgius D zum Süd-Osten hin, Lamarck A und D zum Süd-Westen hin und anstoßend an Darwin zum Norden hin.;Kleine, hohe Wände, anstoßend an Darwin zum Norden hin.;Zerklüftete Ebene mit einem Krater zum Norden hin. Zentralberg. Kleine Krater und Kammlinie.;3;Sehr interessante Formation;13;6 Tage nach ersterm Viertel;5 Tage nach letztem Viertel;5;Bloses Auge;10x Doppelfernrohr
LAMBERT;Krater;Eratosthenianische (Von -3.2 Mrd. bis -1.1 Mrd. Jahre);Johann Heinrich Lambert;Schröter (1802);Chisletti;Insula Sardinia;Kein Name;Mathematiker;Deutschland;deutscher;18;18. Jhd.;Mulhouse;1728;Berlin;1777;Theorien über die Geometrien der Umlaufbahnen der Kometen. Autor der kartographischen Projektion mit seinem Namn. Entdecker der Irrationalität von Pi. Arbeiten über Photometrie.;-21;21.0° West;25.6;25.6° Nord;Nord-West;Süd Teil von Mare Imbrium;20;Pytheas;336;5e7 / 6e1;024N 029N/C 191N 201N ;;;30;30;18;18;2690;8200;0.0897;A_______________________A;Isolierte, kreisförmige Formation.;Steile Stelle, angrenzend an den kleinen Krater Lambert A zum Nord-Westen hin und den großen Geist-Krater Lambert R zum Süden hin.;Hohe Wände mit Terrassen.;Zerklüftete Ebene. Zentralberg mit kleinem Krater zum Gipfel hin. Kleine Krater.;4;Außergewöhnliche Formation;9;2 Tage nach ersterm Viertel;1 Tag nach Letztes Viertel;30;10x Doppelfernrohr;50 mm Refraktor
LAMBERT R;Krater;Entstehungsperiode nicht gefunden;Lambert R - Johann Heinrich Lambert;(??);Kein Name;Kein Name;Kein Name;Mathematiker;Deutschland;deutscher;18;18. Jhd.;Mulhouse;1728;Berlin;1777;Theorien über die Geometrien der Umlaufbahnen der Kometen. Autor der kartographischen Projektion mit seinem Namn. Entdecker der Irrationalität von Pi. Arbeiten über Photometrie.;-20.7;20.7° West;23.9;23.9° Nord;Nord-West;Süd Teil von Mare Imbrium;20;Pytheas;336;;;;;40;40;24;24;0;0;0;Unbekannte Höhe. Kann nicht gezeigt werden.;Kreisförmige Geister-Formation, abfallend zur Lava von Mare Imbrium.;Sehr flache Abhänge, angrenzend an Pytheas N zum Süden hin und einen faltigen Rücken, Süd-Ost Nord-West orientiert  zum Osten hin.;Quasi flache Wände, angrenzend an den kleinen Krater Lambert B zum Nord-Osten hin.;Sehr flache Ebene, gefüllt mit der Lava von Mare Imbrium.;4;Außergewöhnliche Formation;9;2 Tage nach ersterm Viertel;1 Tag nach Letztes Viertel;30;10x Doppelfernrohr;50 mm Refraktor
LAME;Krater;Pre-Imbrianische (Von -4.55 Mrd. bis -3.85 Mrd. Jahre) ?;Gabriel Lamé;Arthur / Whitaker (1963);Kein Name;Kein Name;Kein Name;Mathematiker und Ingenieur;Frankreich;französischer;19;19. Jhd.;Tours;1795;Paris;1870;Viele Arbeiten in Russland im Jahre 1820. Professor der Physik in der französischen Polytechnischen Schule im Jahre 1832. Mitentwickler der ersten Eisenbahnlinien. Wurde im Jahre 1843 in die französische Akademie der Wissenschaften gewählt .;64;64.0° Ost;-14.7;14.7° Süd;Süd-Ost;Mond Ost-Süd-Ost Bogen;60;Vendelinus;189;15b4 / 15c5;303C/S 099C 105C 112C;;;82;82;51;51;0;0;0;Unbekannte Höhe. Kann nicht gezeigt werden.;;Steile Stelle, anstoßend an Vendelinus zum Süd-Westen hin, angrenzend an Lamé F und E zum Nord-Osten hin und Lamé 'M zum Süd-Osten hin.;Hohe Wände, anstoßend an Lamé G zum Süd-Osten hin und Lamé J zum Nord-Osten hin.;;3;Sehr interessante Formation;3;3 Tage nach Neumond;2 Tage nach Vollmond;30;10x Doppelfernrohr;50 mm Refraktor
LAMECH;Krater;Copernicianische (Von -1.1 Mrd. bis heute) ?;Félix Chemla Lamèch;Müller (1935);Kein Name;Kein Name;Kein Name;Astronom;Frankreich;französischer;20;20. Jhd.;?;1894;?;1962;Mondvermesser. Autor einer Mondkarte.;13.1;13.1° Ost;42.7;42.7° Nord;Nord-Ost;nördlich von Mare Serenitatis Region;13;Eudoxus;350;2d3;351N 357N 154N 161N;;;13;13;8;8;1460;4400;0.1123;A__________________A;Kreisförmige Formation.;Steile Stelle, angrenzend an Eudoxus D zum Norden hin.;Kleine, hohe Wände.;Kleine, ausgedehnte und flache Ebene.;2;Ziemlich interessante Formation;6;6 Tage nach Neumond;5 Tage nach Vollmond;50;50 mm Refraktor;100 mm Refraktor
LAMONT;Krater;Pre-Imbrianische (Von -4.55 Mrd. bis -3.85 Mrd. Jahre) ?;Johann von Lamont;Krieger / König (1912);Kein Name;Kein Name;Kein Name;Astronom;Deutschland;deutscher;19;19. Jhd.;Braemar;1805;Bogenhausen;1879;Berechnete die Masse von Uranus mittels seiner Monde. Arbeiten über Sternphotometrie. Entdecker der periodischen Abweichungen der magnetischen Declination.;23.2;23.2° Ost;5;5.0° Nord;Nord-Ost;Ost Teil von Mare Tranquillitatis;35;Arago;276;1b2 / 1c2 / 3g3 / 3h3;343C 148C 154C;;;75;75;45;45;0;0;0;Unbekannte Höhe. Kann nicht gezeigt werden.;Bemerkenswerte kreisförmige Geister-Formation mit doppelten Abschluß, gelegen zum Süd-Osten von Arago hin .;Form aus faltigen, konzentrischen und radialen Rücken in Mare Tranquillitatis.;;;4;Außergewöhnliche Formation;5;5 Tage nach Neumond;4 Tage nach Vollmond;30;10x Doppelfernrohr;50 mm Refraktor
LANDSTEINER;Kleiner Krater;Eratosthenianische (Von -3.2 Mrd. bis -1.1 Mrd. Jahre) ?;Karl Landsteiner (ehem. Timocharis F);(??);Kein Name;Kein Name;Kein Name;Biologe;U. S. A.;amerikanischerer;20;20. Jhd.;Vienne;1868;New York;1943;Entdecker der Blutgruppen im Jahre1900 und und des Rhesusfaktors im Jahre 1941. Nobel Preis  für Medizin im Jahre1930.;-14.8;14.8° West;31.3;31.3° Nord;Nord-West;Zentralteil von Mare Imbrium;11;Le Verrier;336;5d8 / 6c2;018N 191N;;;6;6;4;4;1350;4100;0.225;A________A;Kreisförmige Formation mit Schüsselform.;Kleine, steile Stelle.;Kleine, hohe Wände.;Rundliche Ebene.;1;Wenig interessant oder schwierige Formation;8;1 Tag nach Erstes Viertel;Letztes Viertel;50;50 mm Refraktor;100 mm Refraktor
LANGLEY;Krater;Entstehungsperiode nicht gefunden;Samuel Pierpont Langley;Arthur / Whitaker (1963);Kein Name;Kein Name;Kein Name;Astronom und Physiker;U. S. A.;amerikanischerer;19;19. Jhd.;Roxbury;1834;Aiken;1906;Erfinder des Bolometers im Jahre 1881. Messung der athmosphärischen Durchlässigkeit für Sonnenlicht. Konstrukteur eines Flugzeugs im Jahre 1896.;-86.3;86.3° West;51.1;51.1° Nord;Nord-West;Mond Nord-Nord-West Bogen;1;Markov;408;8d6;Q2N/NW;;;60;60;36;36;0;0;0;Unbekannte Höhe. Kann nicht gezeigt werden.;Beschädigte Formation gelegen in der Liberationszone.;Kleine, steile Stelle, angrenzend an Galvani zum Süd-Osten hin, Volta zum Norden hin.;Kleine, hohe Wände, angrenzend an Langley K & J zum Norden hin.;Zerklüftete Ebene.;1;Wenig interessante oder schwierige Formation;14;Vollmond;6 Tage nach letztem Viertel;30;10x Doppelfernrohr;50 mm Refraktor
LANGRENUS;Krater;Eratosthenianische (Von -3.2 Mrd. bis -1.1 Mrd. Jahre);Michel Florent von Langren;Langrenus (1645);Langreni;Insula Major;Kein Name;Ingenieur und Mathematiker;Belgien;belgischer;17;17. Jhd.;?;1600;?;1675;Autor der ersten beschrifteten Mondkarte.;60.9;60.9° Ost;-8.9;8.9° Süd;Süd-Ost;Mond Ost Bogen;49;Langrenus;188;15c6;303C/S 309C 315C 099C 105C 112C 119C;;;132;132;80;80;2600;7900;0.0197;Zu flach. Kann nicht gezeigt werden.;Kreisförmige Formation, deformiert zum Süden hin.;Sehr steile und zerklüftete Abhänge, angrenzend an Lohse Langrenus C und E zum Süden hin, Sommerville zum Nord-Osten hin und Acosta zum Norden hin.;Hohe Wände mit Terrassen, deformiert zum Süden hin.;Ausgedehnte, flache Ebene, mehr zerklüftet zum Nord-Westen hin. Doppelzentralberg 1000 m hoch. Hügel und kleine Krater.;4;Außergewöhnliche Formation;3;3 Tage nach Neumond;2 Tage nach Vollmond;5;Bloses Auge;10x Doppelfernrohr
LANSBERG;Krater;Obere Imbrianische (Von -3.8 Mrd. bis -3.2 Mrd. Jahre);Philippe van Lansberge;Riccioli (1651);Kinschotti;Insula Malta;Lansberg;Arzt und Astronom;Belgien;belgischer;16;16. Jhd.;?;1561;?;1632;Autor von Arbeiten über Sonnenuhren und Beobachtungsinstrumente.;-26.6;26.6° West;-0.3;0.3° Süd;Süd-West;Süd-östlich von Oceanus Procellarum Region;42;Fra Mauro;248;5g2 / 7a3 / 9e8;024C 029C 036C 040C 201C 205C;;;39;39;24;24;3110;9400;0.0797;A__________________________A;Isolierte, kreisförmige Formation.;Steile Stelle.;Hohe Wände mit Terrassen.;Kleine, ausgedehnte und flache Ebene. Zentralberg doppelt. Kleine Krater.;4;Außergewöhnliche Formation;9;2 Tage nach ersterm Viertel;1 Tag nach Letztes Viertel;30;10x Doppelfernrohr;50 mm Refraktor
LANSBERG B;Krater;Copernicianische (Von -1.1 Mrd. bis heute) ?;Lansberg B - Philippe van Lansberge;(??);Kein Name;Kein Name;Kein Name;Arzt und Astronom;Belgien;belgischer;16;16. Jhd.;?;1561;?;1632;Autor von Arbeiten über Sonnenuhren und Beobachtungsinstrumente.;-28;28.0° West;-2.4;2.4° Süd;Süd-West;Süd-Ost Teil von Oceanus Procellarum;41;Euclides;252;;;;;9.9;9.9;6;6;2030;6200;0.2051;A_________A;Isolierte, kreisförmige Formation mit Schüsselform.;Kleine, steile Stelle, bedeckt mit glänzendem Auswurf.;Kleine, hohe Wände.;Rundliche Ebene.;1;Wenig interessant oder schwierige Formation;9;2 Tage nach ersterm Viertel;1 Tag nach Letztes Viertel;50;50 mm Refraktor;100 mm Refraktor
LANSBERG C;Krater;Imbrianische (Von -3.85 Mrd. bis -3.2 Mrd. Jahre) ?;Lansberg C - Philippe van Lansberge;(??);Kein Name;Kein Name;Kein Name;Arzt und Astronom;Belgien;belgischer;16;16. Jhd.;?;1561;?;1632;Autor von Arbeiten über Sonnenuhren und Beobachtungsinstrumente.;-29.3;29.3° West;-1.5;1.5° Süd;Süd-West;Süd-Ost Teil von Oceanus Procellarum;41;Euclides;252;;;;;19.8;19.8;12;12;810;2500;0.0409;A____________________________________________________A;Abgestumpfte, kreisförmige Formation.;Kleine, steile Stelle.;Kleine, hohe Wände, zerfurcht von einem kleinen Krater zum Norden hin.;Flache Ebene, gefüllt mit Lava.;2;Ziemlich interessante Formation;9;2 Tage nach ersterm Viertel;1 Tag nach Letztes Viertel;50;50 mm Refraktor;100 mm Refraktor
LANSBERG D;Krater;Eratosthenianische (Von -3.2 Mrd. bis -1.1 Mrd. Jahre) ?;Lansberg D - Philippe van Lansberge;(??);Kein Name;Kein Name;Kein Name;Arzt und Astronom;Belgien;belgischer;16;16. Jhd.;?;1561;?;1632;Autor von Arbeiten über Sonnenuhren und Beobachtungsinstrumente.;-30.5;30.5° West;-3;3.0° Süd;Süd-West;Süd-Ost Teil von Oceanus Procellarum;41;Euclides;218;;;;;10;10;6;6;0;0;0;Unbekannte Höhe. Kann nicht gezeigt werden.;Isolierte, kreisförmige Formation mit Schüsselform.;Kleine, steile Stelle, angrenzend an eine Kuppe zum Süd-Osten hin.;Kleine, hohe Wände.;Rundliche Ebene.;2;Ziemlich interessante Formation;10;3 Tage nach ersterm Viertel;2 Tage nach letztem Viertel;50;50 mm Refraktor;100 mm Refraktor
LANSBERG G;Kleiner Krater;Imbrianische (Von -3.85 Mrd. bis -3.2 Mrd. Jahre) ?;Lansberg G - Philippe van Lansberge;(??);Kein Name;Kein Name;Kein Name;Arzt und Astronom;Belgien;belgischer;16;16. Jhd.;?;1561;?;1632;Autor von Arbeiten über Sonnenuhren und Beobachtungsinstrumente.;-29.5;29.5° West;-0.8;0.8° Süd;Süd-West;Süd-Ost Teil von Oceanus Procellarum;41;Euclides;252;;;;;9.9;9.9;6;6;270;800;0.0273;A_______________________________________________________________________________A;Kreisförmige Formation, gelegen an einem faltigen Rücken von Oceanus Procellarum.;Kleine, steile Stelle, angrenzend an den kleinen Krater Lansberg GA zum Westen hin.;Kleine, hohe Wände, abfallend zum Süden hin.;Flache Ebene, gefüllt mit Lava.;2;Ziemlich interessante Formation;9;2 Tage nach ersterm Viertel;1 Tag nach Letztes Viertel;50;50 mm Refraktor;100 mm Refraktor
LASSELL;Krater;Imbrianische (Von -3.85 Mrd. bis -3.2 Mrd. Jahre) ?;William Lassel;(??);Kein Name;Insula Lesbos;Kein Name;Astronom;England;englischer;19;19. Jhd.;Bolton;1799;Maidenhead;1880;Amateur Astronom. Entdecker von Neptuns Monden Triton im Jahre 1846, Hyperion im Jahre 1848, Ariel und Umbriel im Jahre 1851. Desweiteren Entdecker von 600 Nebeln und Galaxien.;-7.9;7.9° West;-25.9;25.9° Süd;Süd-West;Mare Humorum Region;54;Birt;210;9b4 / 13h4;009S 018C/S 179C 183C/S;;;23;23;14;14;910;2800;0.0396;A______________________________________________________A;Isolierte, kreisförmige Formation, gelegen an der Ostkante von Mare Nubium.;Kleine, steile Stelle, angrenzend an Lassel B und einen kleinen Krater zum Süden hin, einen kleinen Krater zum Westen hin und Alpetragius B zum Nord-Osten hin.;Kleine, hohe Wände.;Flache Ebene, gefüllt mit Lava und mit einer Aufschüttung zum Westen hin.;3;Sehr interessante Formation;8;1 Tag nach Erstes Viertel;Letztes Viertel;30;10x Doppelfernrohr;50 mm Refraktor
LAVOISIER;Krater;Pre-Nectarianische (Von -4.55 Mrd. bis -3.92 Mrd. Jahre) ?;Antoine Laurent de Lavoisier;Mädler (1837);Kein Name;Kein Name;Kein Name;Chemiker;Frankreich;französischer;18;18. Jhd.;Paris;1743;Paris;1794;Mitglied der französischen Akademie der Wissenschaften im Jahre 1768. Grundmaß der Konservation. Erste Luftanalyse;-81.2;81.2° West;38.2;38.2° Nord;Nord-West;Mond Nord-West Bogen;8;Rümker;361;8f4;080N Q2NW 247N;;;70;70;42;42;2000;6100;0.0286;A___________________________________________________________________________A;Deformierte Formation, gelegen in der Liberationszone.;Kleine, steile Stelle, angrenzend an Lavoisier H zum Osten hin und Lavoisier W und F zum Süden hin.;Ziemlich hohe Wände.;Flache Ebene. Zentralberg. Kleine Krater, wie drei mächtige Krater.;2;Ziemlich interessante Formation;14;Vollmond;6 Tage nach letztem Viertel;30;10x Doppelfernrohr;50 mm Refraktor
LAWRENCE;Krater;Pre-Imbrianische (Von -4.55 Mrd. bis -3.85 Mrd. Jahre) ?;Ernest Orlando Lawrence (ehem. Taruntius M);(??);Kein Name;Kein Name;Kein Name;Physiker;U. S. A.;amerikanischer;20;20. Jhd.;Canton;1901;Palo Alto;1958;Erfinder des Zyklotron im Jahre 1930.  Unterstützte die Vervollkommnung des ersten Atomreaktors. Nobel Preis im Jahre 1939.;43.2;43.2° Ost;7.4;7.4° Nord;Nord-Ost;Nord Rand of Mare Fecunditatis;37;Taruntius;269;3d3;323N/C 131C 135C;;;24;24;15;15;1000;3000;0.0417;A___________________________________________________A;Beschädigte, kreisförmige Formation, gelegen zum Osten hin am äußersten Rand der Rima Cauchy.;Kleine, steile Stelle, angrenzend an einen kleinen Krater zum Nord-Westen hin und einen kleinen Krater zum Süd-Osten hin.;Kleine, hohe Wände.;Flache Ebene, gefüllt mit Lava. Hügel.;2;Ziemlich interessante Formation;4;4 Tage nach Neumond;3 Tage nach Vollmond;30;10x Doppelfernrohr;50 mm Refraktor
LE GENTIL;Krater;Obere Imbrianische (Von -3.8 Mrd. bis -3.2 Mrd. Jahre);Guillaume H. le Gentil;Schröter (1802);Kein Name;Kein Name;Kein Name;Astronom;Frankreich;französischer;18;18. Jhd.;?;1725;?;1792;??;-76.5;76.5° West;-74.4;74.4° Süd;Süd-West;Mond Süd Bogen;72;Clavius;58;10f1 / 12c1;067S 075S 080S Q3SW/S 213S 225S 233S 247S;;;109;109;68;68;0;0;0;Unbekannte Höhe. Kann nicht gezeigt werden.;Beschädigte, kreisförmige Formation, gelegen am Rand der Liberationszone.;Abhänge gerillt mit Kratern, wie Le Gentil V und U zum Norden hin.;Ziemlich hohe Wände, gerillt von vielen Kratern.;Sehr zerklüftete Ebene, angrenzend an Le Gentil B & C. Zerborstener Hügel und kleine Krater.;2;Ziemlich interessante Formation;13;6 Tage nach ersterm Viertel;5 Tage nach letztem Viertel;5;Bloses Auge;10x Doppelfernrohr
LE MONNIER;Krater;Nectarianische (Von -3.92 Mrd. bis -3.85 Mrd. Jahre);Pierre Charles le Monnier;Lohrmann (1824);Kein Name;Kein Name;Kein Name;Astronom;Frankreich;französischer;18;18. Jhd.;Paris;1715;Herils;1799;Messung des Meridianbogens in Lapland im Jahre 1737. Bestimmung der Höhe des Himmelspols in Paris. Mitglied der französischen Akademie der Wissenschaften im Jahre 1741.;30.6;30.6° Ost;26.6;26.6° Nord;Nord-Ost;nördlich von Mare Tranquillitatis Region;25;Römer;312;1b6 / 3f7 / 4g2;334N 131N 135lN/C 143N/C 148N;;;61;61;37;37;2400;7300;0.0393;A______________________________________________________A;Beschädigte, kreisförmige Formation, teilweise abfallend in Mare Serenitatis. Landeplatz von Luna 21 und Fahrgebiet von Lunachod 2.;Ziemlich steile Stelle,unversehrt zum Westen hin.;Zusammengebrochene Wände zum Westen hin, sich öffnend zum Mare Serenitatis.;Flache Ebene, gefüllt mit sehr dunkler Lava.;3;Sehr interessante Formation;5;5 Tage nach Neumond;4 Tage nach Vollmond;30;10x Doppelfernrohr;50 mm Refraktor
LE VERRIER;Krater;Eratosthenianische (Von -3.2 Mrd. bis -1.1 Mrd. Jahre) ?;Urbain Le Verrier;Schmidt  (1878);Kein Name;Insula Erroris;Kein Name;Astronom;Frankreich;französischer;19;19. Jhd.;Saint Lô;1811;Paris;1877;Berechnete die Position von Neptun im Jahre 1846. Mitglied der französischen Akademie der Wissenschaften im Jahre 1846. Direktor des Observatoriums von Paris im Jahre 1854.;-20.6;20.6° West;40.3;40.3° Nord;Nord-West;Zentralteil von Mare Imbrium;11;Le Verrier;356;6d4;018N 024N 029N 036N 191N 201N;;;20;20;12;12;2100;6400;0.105;A___________________A;Kreisförmige Formation. Bildet ein bemerkenswertes Paar mit Helicon.;Ziemlich steile Stelle, angrenzend an Le Verrier T zum Süden hin.;Ziemlich hohe Wände, Beschädigte zum Norden hin.;Flache Ebene. Kammlinie. Kleiner Berg ;3;Sehr interessante Formation;9;2 Tage nach ersterm Viertel;1 Tag nach Letztes Viertel;30;10x Doppelfernrohr;50 mm Refraktor
LE VERRIER B;Kleiner Krater;Eratosthenianische (Von -3.2 Mrd. bis -1.1 Mrd. Jahre) ?;Le Verrier B - Urbain Le Verrier;(??);Kein Name;Kein Name;Kein Name;Astronom;Frankreich;französischer;19;19. Jhd.;Saint Lô;1811;Paris;1877;Berechnete die Position von Neptun im Jahre 1846. Mitglied der französischen Akademie der Wissenschaften im Jahre 1846. Direktor des Observatoriums von Paris im Jahre 1854.;-12.8;12.8° West;40.1;40.1° Nord;Nord-West;Zentralteil von Mare Imbrium;11;Le Verrier;357;;;;;5.1;5.1;3;3;980;3000;0.1922;A_________A;Kreisförmige Formation mit Schüsselform.;Kleine, steile Stelle.;Kleine, hohe Wände.;Rundliche Ebene.;1;Wenig interessant oder schwierige Formation;8;1 Tag nach Erstes Viertel;Letztes Viertel;50;50 mm Refraktor;100 mm Refraktor
LE VERRIER D;Kleiner Krater;Eratosthenianische (Von -3.2 Mrd. bis -1.1 Mrd. Jahre) ?;Le Verrier D - Urbain Le Verrier;(??);Kein Name;Kein Name;Kein Name;Astronom;Frankreich;französischer;19;19. Jhd.;Saint Lô;1811;Paris;1877;Berechnete die Position von Neptun im Jahre 1846. Mitglied der französischen Akademie der Wissenschaften im Jahre 1846. Direktor des Observatoriums von Paris im Jahre 1854.;-12.2;12.2° West;39.6;39.6° Nord;Nord-West;Zentralteil von Mare Imbrium;11;Le Verrier;357;;;;;9.1;9.1;6;6;1830;5500;0.2011;A_________A;Kreisförmige Formation mit Schüsselform.;Kleine, steile Stelle.;Kleine, hohe Wände.;Rundliche Ebene.;1;Wenig interessant oder schwierige Formation;8;1 Tag nach Erstes Viertel;Letztes Viertel;50;50 mm Refraktor;100 mm Refraktor
LE VERRIER W;Kleiner Krater;Entstehungsperiode nicht gefunden;Le Verrier W - Urbain Le Verrier;(??);Kein Name;Kein Name;Kein Name;Astronom;Frankreich;französischer;19;19. Jhd.;Saint Lô;1811;Paris;1877;Berechnete die Position von Neptun im Jahre 1846. Mitglied der französischen Akademie der Wissenschaften im Jahre 1846. Direktor des Observatoriums von Paris im Jahre 1854.;-13.9;13.9° West;39.4;39.4° Nord;Nord-West;Zentralteil von Mare Imbrium;11;Le Verrier;357;;;;;3.3;3.3;2;2;620;1900;0.1879;A__________A;Kreisförmige Formation mit Schüsselform.;Kleine, steile Stelle.;Kleine, hohe Wände.;Rundliche Ebene.;1;Wenig interessant oder schwierige Formation;8;1 Tag nach Erstes Viertel;Letztes Viertel;100;100 mm Reflektor;200 mm Reflektor
LEAKEY;Krater;Imbrianische (Von -3.85 Mrd. bis -3.2 Mrd. Jahre) ?;Louis Seymour Bazett Leakey (ehem. Censorinus F);(??);Kein Name;Kein Name;Kein Name;Anthropologe;Großbritannien;britischer;20;20. Jhd.;Kabete;1903;London;1972;Autor vieler Arbeiten über Abstammung des Menschen. Entdecker des Urmenschen von Oldoway.;37.4;37.4° Ost;-3.2;3.2° Süd;Süd-Ost;Theophilus Krater Nord-Ost Region;47;Capella;230;3e1 / 15e7;328C/S 131C 135C/S;;;13;13;8;8;1350;4100;0.1038;A___________________A;Kreisförmige Formation mit Schüsselform.;Kleine, steile Stelle.;Ziemlich hohe Wände.;Rundliche Ebene.;2;Ziemlich interessante Formation;5;5 Tage nach Neumond;4 Tage nach Vollmond;50;50 mm Refraktor;100 mm Refraktor
LEE;Krater;Nectarianische (Von -3.92 Mrd. bis -3.85 Mrd. Jahre);John Lee;Birt / Lee (1865);Kein Name;Kein Name;Kein Name;Astronom;England;englischer;19;19. Jhd.;?;1783;?;1866;Selenograph.;-40.7;40.7° West;-30.7;30.7° Süd;Süd-West;Schickard Krater Region;62;Schickard;138;9h2 / 11c1 / 12d8;048C/S 055C/S 205S 213C/S;;;40;40;25;25;1340;4100;0.0327;A__________________________________________________________________A;Beschädigte Zwillingsformation von Lee M.;Ziemlich steile Stelle, abfallend zum Nord-Osten hin in die Lava von Mare Humorum, angrenzend an Doppelmayer zum Nord-Westen hin und Lee M zum Nord-Osten hin.;Kleine, hohe Wände, abfallend zum Nord-Osten hin und mit einer Reihe von senkrechten internen Kämmen, zum Süd-Osten hin getrennt von Lee M.;Flache Ebene, gefüllt mit Lava, zurammenhängend mit Lee M.;3;Sehr interessante Formation;10;3 Tage nach ersterm Viertel;2 Tage nach letztem Viertel;30;10x Doppelfernrohr;50 mm Refraktor
