NAME;TYPE;PERIOD;NAMEDETAIL;NAMEORIGIN;LANGRENUS;HEVELIUS;RICCIOLI;WORK;COUNTRY;NATIONLITY;CENTURYN;CENTURYC;BIRTHPLACE;BIRTHDATE;DEATHPLACE;DEATHDATE;FACTS;LONGIN;LONGIC;LATIN;LATIC;QUADRANT;AREA;RUKL;RUKLC;VISCARDY;HATFIELD;WESTFALL;WOOD;LOPAM;LENGTHKM;WIDEKM;LENGTHMI;WIDEMI;HEIGHTM;HEIGHTFE;RAPPORT;PROFIL;GENERAL;SLOPES;WALLS;FLOOR;INTERESTN;INTERESTC;LUNATION;MOONDAYS;MOONDAYM;DIAMINST;THINSTRU;PRINSTRU
REINER GAMMA;Krater;Copernicianische (Von -1.1 Mrd. bis heute) ?;Reiner Gamma - Vincentio Reinieri;??;Bullialdi;Mons Audus;Galilaeus;Mathematiker;Italien;italienischer;17;17. Jhd.;?;?;?;1648;Anhänger von Galileo.;-59;59.0° West;8;8.0° Nord;Nord-West;Mond West Bogen;28;Galilei;259;1b7 / 2a1 / 2a2 / 3g8 / 4g3;061 C 067N/C 075N/C 080N/C 233N/C 237C;;;40;30;24;18;0;0;0;Unbekannte Höhe. Kann nicht gezeigt werden.;Formation, zusammengesetzt aus verteiltem, hellen Material in Form einer Kiste. Scheinbar verbunden mit einem komplett versunkenen Geist-Krater.;;;;3;Sehr interessante Formation;12;5 Tage nach ersterm Viertel;4 Tage nach letztem Viertel;30;10x Doppelfernrohr;50 mm Refraktor
REINHOLD;Krater;Eratosthenianische (Von -3.2 Mrd. bis -1.1 Mrd. Jahre);Erasmus Reinhold;Riccioli (1651);Mexiae;Mons Neptunus;Reinhold;Astronom;Deutschland;deutscher;16;16. Jhd.;Saalfeld;1511;Saalfeld;1553;Anhänger von Copernicus. Autor einer neuen Berechnung zur Unterstützung eines Modells eines heliozentrischen Systems.;-22.8;22.8° West;3.3;3.3° Nord;Nord-West;Copernic Krater Region;31;Copernicus;248;7c8 / 8d2;024C 029C 036C 191C 201C 705C;;;48;48;29;29;3260;9900;0.0679;A_______________________________A;Isolierte, kreisförmige Formation.;Sehr steile und zerklüftet Abhänge, angrenzend an den Geist-Krater Rheinhold B zum Nord-Osten hin.;Sehr hohe Wände mit Terrassen.;Flache Ebene mit kleinen, außerhalb der Mitte gelegenen Bergen und kleinen Kratern.;4;Außergewöhnliche Formation;9;2 Tage nach ersterm Viertel;1 Tag nach Letztes Viertel;30;10x Doppelfernrohr;50 mm Refraktor
REINHOLD B;Krater;Imbrianische (Von -3.85 Mrd. bis -3.2 Mrd. Jahre) ?;Reinhold B -Erasmus Reinhold;??;Kein Name;Kein Name;Kein Name;Astronom;Deutschland;deutscher;16;16. Jhd.;Saalfeld;1511;Saalfeld;1553;Anhänger von Copernicus. Autor einer neuen Berechnung zur Unterstützung eines Modells eines heliozentrischen Systems.;-21.5;21.5° West;4.3;4.3° Nord;Nord-West;Copernic Krater Region;31;Copernicus;248;3d5;;;;24;24;15;15;1060;3200;0.0442;A________________________________________________A;Ziemlich geisterhafte, kreisförmige Formation.;Kleine, steile Stelle, angrenzend an den kleinen Krater Rheinhold H zum Süd-Osten hin.;Kleine, hohe Wände.;Flache Ebene, gefüllt mit dunkler Lava, angrenzend an den kleinen Krater Rheinhold A zum Süd-Westen hin. Spalte und Hügel.;3;Sehr interessante Formation;9;2 Tage nach ersterm Viertel;1 Tag nach Letztes Viertel;30;10x Doppelfernrohr;50 mm Refraktor
REPSOLD;Krater;Pre-Nectarianische (Von -4.55 Mrd. bis -3.92 Mrd. Jahre);Johann G. Repsold;Mädler (1837);Kein Name;Kein Name;Kein Name;Optiker;Deutschland;deutscher;19;19. Jhd.;?;1771;?;1830;??;-78.5;78.5° West;51.4;51.4° Nord;Nord-West;Mond Nord-Nord-West Bogen;1;Markov;362;10c5 / 14g5;075N 080N Q2N NW, 237N, 247N;;;107;107;65;65;0;0;0;Unbekannte Höhe. Kann nicht gezeigt werden.;Abgewrackte Formation. Gelegen in der Liberationszone.;Kleine, steile Stelle, am höchsten zum Osten hin.;Kleine, hohe Wände zusammengebrochen zum Süden hin.;Flache Ebene, angrenzend an Rimae Repsold & Repsold G. Kleine Krater.;2;Ziemlich interessante Formation;14;Vollmond;6 Tage nach letztem Viertel;5;Bloses Auge;10x Doppelfernrohr
RESPIGHI;Krater;Entstehungsperiode nicht gefunden;Lorenzo Respighi (ehem. Dubiago C);(??);Kein Name;Kein Name;Kein Name;Astronom;Italien;italienischer;19;19. Jhd.;?;1824;?;1890;??;71.9;71.9° Ost;2.8;2.8° Nord;Nord-Ost;Mond Ost Bogen;38;Neper;229;3b4;105N;;;19;19;12;12;0;0;0;Unbekannte Höhe. Kann nicht gezeigt werden.;Kreisförmige Formation, gelegen entlang der Liberationszone.;Ziemlich steile Stelle, angrenzend an Respighi B zum Nord-Westen hin und Respighi N, große, dunkle und gestreckte Krater zum Süden hin.;Kleine, hohe Wände.;Rundliche Ebene.;2;Ziemlich interessante Formation;2;2 Tage nach Neumond;1 Tag nach Vollmond;50;50 mm Refraktor;100 mm Refraktor
RHAETICUS;Krater;Pre-Imbrianische (Von -4.55 Mrd. bis -3.85 Mrd. Jahre) ?;Joachim von Lauchen (oder Rheticus);(??);Kein Name;Mons Mysius;Kein Name;Astronom;Deutschland;deutscher;16;16. Jhd.;Feldkirch;1514;Kosice;1576;Schüler von Copernicus, der dessen Theorien erweiterte, leitete den Druck dessen Buch 'De Revolutionibus orbium coelestium' im Jahre 1543. Autor einer Sinustabelle mit 15 Dezimalstellen.;4.9;4.9° Ost;0;0.0° Nord;Nord-Ost;Mondscheibenzentrum;33;Triesnecker;286;2f3;357C 003C 161C 167C 174C;;;49;43;30;26;0;0;0;Unbekannte Höhe. Kann nicht gezeigt werden.;Unregelmäßige Formation, teilweise ohne Ummantelung.;Steile Stelle, angrenzend an verschiedene kleine Krater, sowie eine Süd-West Nord-Ost orientiert Kette zum Nord-Osten hin.;Kleine, hohe Wände zum Osten hin.;Ziemlich flache Ebene. Kleiner Zentralberg. Hügel und kleine Krater.;3;Sehr interessante Formation;7;Erstes Viertel;6 Tage nach Vollmond;30;10x Doppelfernrohr;50 mm Refraktor
RHEITA;Krater;Typical Nectarianische (Von -3.92 Mrd. bis -3.85 Mrd. Jahre);Anton Maria Schyrlaeus von Rheita;Riccioli (1651);Kein Name;Kein Name;Rheita;Astronom;Tscheslovakei;tschechoslovakischer;17;17. Jhd.;Bohême;1597;Ravenne;1660;Hersteller des Teleskops von Kepler und Autor einer Mondkarte im Jahre 1645.;47;47.0° Ost;-37.1;37.1° Süd;Süd-Ost;Vallis Rheita Region;68;Rheita;76;1c4 / 3h5;315S 323S 328S 124C/S 131S 135S;;;68;68;42;42;4000;12100;0.0571;A_____________________________________A;Kreisförmige Formation, bildet ein interessantes Trio mit Fabricius und Metius orientiert in Richtung Süd-West Nord-Ost .;Steile Stelle, ausgefranzt Süd-Westen hin durch Vallis Rheita und anstoßend an Rheita A zum Osten hin.;Hohe Wände mit Terrassen, angrenzend an einen kleinen Krater zum Norden hin.;Flache Ebene. Zentralberg.;3;Sehr interessante Formation;4;4 Tage nach Neumond;3 Tage nach Vollmond;30;10x Doppelfernrohr;50 mm Refraktor
RHEITA E;Krater;Pre-Imbrianische (Von -4.55 Mrd. bis -3.85 Mrd. Jahre) ?;Rheita E - Anton Maria Schyrlaeus von Rheita;??;Kein Name;Kein Name;Kein Name;Astronom;Tscheslovakei;tschechoslovakischer;17;17. Jhd.;Bohême;1597;Ravenne;1660;Hersteller des Teleskops von Kepler und Autor einer Mondkarte im Jahre 1645.;49;49.0° Ost;-34.2;34.2° Süd;Süd-Ost;Vallis Rheita Region;68;Rheita;76;2f4;;;;64;31;40;19;0;0;0;Unbekannte Höhe. Kann nicht gezeigt werden.;Gestreckte Formation, vereinigt mit drei Süd Nord ausgerichteten Kratern.;Ziemlich steile Stelle, angrenzend an einen Krater zum Süden hin und Rheita M zum Süd-Westen hin.;Ziemlich hohe Wände.;Flache Ebene mit durchquerender Kammlinie zum Süden hin und einen Berg zum Norden hin.;3;Sehr interessante Formation;4;4 Tage nach Neumond;3 Tage nach Vollmond;30;10x Doppelfernrohr;50 mm Refraktor
RICCIOLI;Umwandete Fläche;Pre-Nectarianische (Von -4.55 Mrd. bis -3.92 Mrd. Jahre);Giovanni Baptista Riccioli;Riccioli (1651);Kein Name;Stagnum Miris;Riccioli;Astronom und Geograph;Italien;italienischer;17;17. Jhd.;Ferrare;1598;Bologne;1671;Erster Beobachter Beobachter eines Doppelsterns (Mizar). Autor des 'Neuen Almanach', enthält eine Mondkarte, welche eine neue Mondnomenklatur enthielt und von Grimaldi gezeichnet wurde.;-74.3;74.3° West;-3;3.0° Süd;Süd-West;Mond West Bogen;39;Grimaldi;226;1f7 / 2e1;075C 080C Q3W 247C;;;146;146;88;88;0;0;0;Unbekannte Höhe. Kann nicht gezeigt werden.;Beschädigte, kreisförmige Formation.;Ziemlich steile Stelle, angrenzend an einen großen Krater zum Süd-Westen hin, Riccioli K zum Westen hin und Riccioli G zum Nord-Osten hin.;Höhere Wände zum Osten hin als zum Westen hin.;Ebene sehr zerklüftet zum Süden hin und gefüllt mit Lava zum Norden hin. Enthält Rimae Riccioli. Hügel, kleine Krater und Kammlinien.;3;Sehr interessante Formation;13;6 Tage nach ersterm Viertel;5 Tage nach letztem Viertel;5;Bloses Auge;10x Doppelfernrohr
RICCIUS;Krater;Pre-Nectarianische (Von -4.55 Mrd. bis -3.92 Mrd. Jahre);Matteo Ricci;Riccioli (1651);Bichi;Kein Name;Riccius;Astronom Mathematiker und Geograph;Italien;italienischer;16;16. Jhd.;Macerata;1552;Pékin;1610;Jesuit, missionierte in China. Publizierte eine Weltkarte.;26;26.0° Ost;-36.9;36.9° Süd;Süd-Ost;Rupes Altai Süd Region;67;Rabbi Levi;80;6f4 / 8a5;334S 343S 135S 143S 148S 154S;;;69;69;43;43;0;0;0;Unbekannte Höhe. Kann nicht gezeigt werden.;Sehr beschädigte, kreisförmige Formation und gerillt von Kratern auf der anderen Seite.;Steile Stelle, überformt zum Osten hin durch eine Kette von  Kratern, wie Riccius H A & B.;Hohe Wände, erhalten zum Westen hin und angrenzend an Rabbi Levi M zum Süden hin.;Zerklüftete Ebene, angrenzend an zwei Krater und verschieden kleinen Kratern. Kamm und Hügelreihen.";3;Sehr interessante Formation;5;5 Tage nach Neumond;4 Tage nach Vollmond;30;10x Doppelfernrohr;50 mm Refraktor
RICCIUS E;Krater;Imbrianische (Von -3.85 Mrd. bis -3.2 Mrd. Jahre) ?;Riccius E - Matteo Ricci;(??);Kein Name;Kein Name;Kein Name;Astronom Mathematiker und Geograph;Italien;italienischer;16;16. Jhd.;Macerata;1552;Pékin;1610;Jesuit, missionierte in China. Publizierte eine Weltkarte.;26;26.0° Ost;-40;40.0° Süd;Süd-Ost;Rupes Altai Süd Region;67;Rabbi Levi;81;9g3 / 11b2;;;;21;21;13;13;3500;10600;0.1591;A____________A;Kreisförmige Formation, gelegen im Norden von Riccius.;Ziemlich steile Stelle, angrenzend an Riccius J zum Süd-Westen hin.;Hohe Wände, schalenförmig deformiert zum Nord-Westen hin.;Ausgedehnte, kleine, flache Ebene.;2;Ziemlich interessante Formation;5;5 Tage nach Neumond;4 Tage nach Vollmond;30;10x Doppelfernrohr;50 mm Refraktor
RIEMANN;Umwandete Fläche;Entstehungsperiode nicht gefunden;Bernhard  Riemann;Arthur / Whitaker (1963);Kein Name;Kein Name;Kein Name;Mathematiker;Deutschland;deutscher;19;19. Jhd.;Breselenz;1826;Selasca;1866;Theorie von komplexen Variablen und komplexen Funktionen im Jahre 1851. Urheber der Topologie. Erfinder einer nichteuklidischen Geometrie.;87.2;87.2° Ost;39.5;39.5° Nord;Nord-Ost;Mond Nord-Ost Bogen;16;Gauss;0;600000;Q1NE;;;110;110;67;67;0;0;0;Unbekannte Höhe. Kann nicht gezeigt werden.;Beschädigte, kreisförmige Formation, gelegen in der Liberationszone.;Kleine, steile Stelle, gerillt von kleinen Kratern und angrenzend an Beals zum Süden hin und Riemann B zum Norden hin.;Ziemlich hohe Wände zum Osten hin und gerillt von kleinen Kratern zum Westen hin.;Zerklüftete Ebene, angrenzend an viele kleine Krater.;1;Wenig interessant oder schwierige Formation;2;2 Tage nach Neumond;1 Tag nach Vollmond;5;Bloses Auge;10x Doppelfernrohr
RIMA AGATHARCHIDES;Rille;Imbrianische (Von -3.85 Mrd. bis -3.2 Mrd. Jahre) ?;Rille von Agatharchides - Agatharchide;(??);Kein Name;Kein Name;Kein Name;Geograph und Historiker;Griechenland;griechischer;-2;2 nd Jhd. BC;?;vers 100 BC;?;?;??;-28;28.0° West;-20;20.0° Süd;Süd-West;West Teil von Mare Nubium;53;Bullialdus;173;3d4;;;;50;2;30;1;0;0;0;Unbekannte Höhe. Kann nicht gezeigt werden.;Enge Rille.;Nord Süd orientiert.;Kreuzt den großen Krater Agatharchides P.;;2;Ziemlich interessante Formation;9;2 Tage nach ersterm Viertel;1 Tag nach Letztes Viertel;150;150 mm Reflektor;300 mm Reflektor
RIMA ARCHYTAS;Rille;Imbrianische (Von -3.85 Mrd. bis -3.2 Mrd. Jahre) ?;Rille von Archytas - Archytas;(??);Kein Name;Kein Name;Kein Name;Wissenschaftler und Staatsmann;Griechenland;griechischer;-5;5 . Jhd. BC;Tarente;428 BC;Tarente;347 BC;Freund von Pythagoras und Platon. Erfinder der Kiste und von Flugmaschinen.;3;3.0° Ost;50;50.0° Nord;Nord-Ost;Mond Nord Bogen;4;Archytas;399;3d4;;;;90;0.5;55;0;0;0;0;Unbekannte Höhe. Kann nicht gezeigt werden.;Sehr schmale Rille, orientiert Süd-Ost Nord-West.;;;;1;Wenig interessant oder schwierige Formation;7;Erstes Viertel;6 Tage nach Vollmond;999;+ 400 mm Reflektor;+ 500 mm Reflektor
RIMA ARIADAEUS;Rille;Imbrianische (Von -3.85 Mrd. bis -3.2 Mrd. Jahre) ?;Rille von Ariadaeus - Ariadaeus;(??);Kein Name;Kein Name;Kein Name;König;Mazedonien;mazedonischer;-4;4 . Jhd. BC;?;?;?;317 BC;Sohn von Philippe II. Autor einer Zusammenstellung von Finsternissen. Zerstörte die Ordnung von Olympia.;13;13.0° Ost;7;7.0° Nord;Nord-Ost;östlich von Mare Tranquillitatis Region;34;Hyginus;280;9b3 / 13h4;351C 154C 161C 167N;;;220;7;133;4;480;1500;0.0022;Zu flach. Kann nicht gezeigt werden.;Große, rechteckige, Ost West orientierte Rille. Verzweigungen zum Westen hin, mit einer Verzweigung, welche zur Rima Hyginus führt.;Spaltet sich zum Osten hin, in der Nähe von Ariadaeus. Aufgefüllt mit einem bergigen Kap im Norden von Silberschlag. Ebene gefüllt von offenen Plätzen.;;;4;Außergewöhnliche Formation;6;6 Tage nach Neumond;5 Tage nach Vollmond;50;50 mm Refraktor;100 mm Refraktor
RIMA ARISTOTELES;Rille;Imbrianische (Von -3.85 Mrd. bis -3.2 Mrd. Jahre) ?;Rille von Aristote - Aristote;(??);Kein Name;Kein Name;Kein Name;Philosoph;Griechenland;griechischer;-4;4 . Jhd. BC;Stagire;384 BC;Chalcis;322 BC;Universal Wissenschaftler. Urheber der Logik. Lehrer von Alexander dem Großen. Arbeiten über Tiere und Steine.;21;21.0° Ost;52;52.0° Nord;Nord-Ost;Mond Nord Bogen;5;Aristoteles;372;2e6 / 2f6;;;;0;2;0;1;0;0;0;Unbekannte Höhe. Kann nicht gezeigt werden.;Sehr feine Rille. Zusammengesetzt aus einer Zusammenstellung kleiner Krater.;;;;1;Wenig interessant oder schwierige Formation;5;5 Tage nach Neumond;4 Tage nach Vollmond;150;150 mm Reflektor;300 mm Reflektor
RIMA BILLY;Rille;Pre-Imbrianische (Von -4.55 Mrd. bis -3.85 Mrd. Jahre) ?;Rille von Billy - Jacques de Billy;(??);Kein Name;Kein Name;Kein Name;Mathematiker und Astronom;Frankreich;französischer;17;17. Jhd.;?;1602;?;1679;Gleichfalls Astrologe. Glaubte an an den mysteriösen Einfluß von Kometen.;-48;48.0° West;-15;15.0° Süd;Süd-West;östlich von Mare Humorum Region;51;Mersenius;223;13g6;;;;70;2;42;1;0;0;0;Unbekannte Höhe. Kann nicht gezeigt werden.;Sehr schmale Rille, orientiert in Richtung  Süd-Ost Nord-West und gelegen an den Süd-Ost Abhängen von Billy.;;;;1;Wenig interessant oder schwierige Formation;11;4 Tage nach ersterm Viertel;3 Tage nach letztem Viertel;150;150 mm Reflektor;300 mm Reflektor
RIMA BIRT;Rille;Imbrianische (Von -3.85 Mrd. bis -3.2 Mrd. Jahre) ?;Rille von Birt - William R. Birt;(??);Kein Name;Kein Name;Kein Name;Astronom;England;englischer;19;19. Jhd.;?;1804;?;1881;Selenograph.;-9;9.0° West;-21;21.0° Süd;Süd-West;Mare Humorum Region;54;Birt;163;9h3 / 11c2;;;;50;1.5;30;1;0;0;0;Unbekannte Höhe. Kann nicht gezeigt werden.;Schmale, rechteckige Rille mit S-Form in ihrer Mitte.;Nord Süd orientiert und verbunden mit dem gestreckten, kleinen Krater Birt E und dem kleinen Krater Birt F.;Erweitert sich in seinem Norden, am äußersten Rand, durch einen zweiten anonymen Graben, wird dann wieder schmaler und parallel.;;4;Außergewöhnliche Formation;8;1 Tag nach Erstes Viertel;Letztes Viertel;150;150 mm Reflektor;300 mm Reflektor
RIMA BRADLEY;Rille;Imbrianische (Von -3.85 Mrd. bis -3.2 Mrd. Jahre) ?;Rille von Bradley - Monts de Bradley (James Bradley);(??);Kein Name;Kein Name;Kein Name;Astronom;England;englischer;18;18. Jhd.;Sherborne;1692;Chalford;1762;Entdeckte die Lichtbrechung im Jahre 1727 und die Lichtstreuung im Jahre 1748. Direktor des Observatoriums von Greenwich. Königlicher Astronom im Jahre 1742.;-2;2.0° West;23;23.0° Nord;Nord-West;Montes Apenninus Region;22;Conon;320;;;;;130;3;79;2;0;0;0;Unbekannte Höhe. Kann nicht gezeigt werden.;Große Süd-West Nord-Ost orientierte Rille, gelegen am Fuße der Montes Apenninus.;;;;4;Außergewöhnliche Formation;7;Erstes Viertel;6 Tage nach Vollmond;100;100 mm Reflektor;200 mm Reflektor
RIMA BRAYLEY;Rille;Imbrianische (Von -3.85 Mrd. bis -3.2 Mrd. Jahre) ?;Rille von Brayley - Edward E. Brayley;(??);Kein Name;Kein Name;Kein Name;Professor;England;englischer;19;19. Jhd.;?;1801;?;1870;Spezialist für Geographie.;-36;36.0° West;23;23.0° Nord;Nord-West;Region zwischen Oceanus Procellarum und Mare Imbrium;19;Brayley;339;9a2 / 13g2 / 14g8;;;;240;0.5;145;0;0;0;0;Unbekannte Höhe. Kann nicht gezeigt werden.;Sehr schmale, geschwungene Rille, orientiert in Richtung Süd-West Nord-Ost.;;;;1;Wenig interessant oder schwierige Formation;10;3 Tage nach ersterm Viertel;2 Tage nach letztem Viertel;999;+ 400 mm Reflektor;+ 500 mm Reflektor
RIMA CALIPPUS;Rille;Imbrianische (Von -3.85 Mrd. bis -3.2 Mrd. Jahre) ?;Rille von Callippos - Callippos;(??);Kein Name;Kein Name;Kein Name;Astronom;Griechenland;griechischer;-4;4 . Jhd. BC;Cyzique;350 BC;?;?;Schüler von Eudoxe und Direktor dessen Schule. Verbesserung der Zyklen von Meton.;13;13.0° Ost;37;37.0° Nord;Nord-Ost;nördlich von Mare Serenitatis Region;13;Eudoxus;351;6f7 / 8a8;;;;40;1.5;24;1;0;0;0;Unbekannte Höhe. Kann nicht gezeigt werden.;Süd-West Nord-Ost orientierte, schmale Rille, gelegen am Fuß der Montes Caucasus.;;;;1;Wenig interessant oder schwierige Formation;6;6 Tage nach Neumond;5 Tage nach Vollmond;150;150 mm Reflektor;300 mm Reflektor
RIMA CARDANUS;Rille;Entstehungsperiode nicht gefunden;Rille von Cardanus - Girolamo Cardano (Jérome Cardan);(??);Kein Name;Kein Name;Kein Name;Arzt, Mathematiker und Philosoph;Italien;italienischer;16;16. Jhd.;Pavie;1501;Rom;1576;Zahlreiche, philosophische Arbeiten, einschließliche der Astrologie. Lösung von Gleichungen dritten Grades. Urhebers der imaginären Zahlen. Erfinder eines Verbindungssystem mit seinem Namen.;-73;73.0° West;11;11.0° Nord;Nord-West;Mond West Bogen;28;Galilei;258;5000000;;;;120;1.5;73;1;0;0;0;Unbekannte Höhe. Kann nicht gezeigt werden.;Ziemlich lange und große Rille, orientiert in Richtung Süd-West Nord-Ost.;;;;3;Sehr interessante Formation;13;6 Tage nach ersterm Viertel;5 Tage nach letztem Viertel;150;150 mm Reflektor;300 mm Reflektor
RIMA CAUCHY;Rille;Imbrianische (Von -3.85 Mrd. bis -3.2 Mrd. Jahre) ?;Rille von Cauchy - Augustin Louis Cauchy;(??);Kein Name;Kein Name;Kein Name;Mathematiker;Frankreich;französischer;19;19. Jhd.;Paris;1789;Sceaux;1857;Autor einer Theorie für Funktionen mit komplexen Varialblen. Arbeiten über die Entwicklung von Reihen und Funktionen. Mitglied der Akademie der Wissenschaften im Jahre 1816 und des Bureau of Longitudes im Jahre 1839.;39;39.0° Ost;10;10.0° Nord;Nord-Ost;Zentralteil von Mare Tranquillitatis;36;Cauchy;271;;;;;210;4;127;2;0;0;0;Unbekannte Höhe. Kann nicht gezeigt werden.;Große und rechteckige Rille am Nord-Ost Abhang von Cauchy und orientiert in Richtung Süd-Ost Nord-West.;Umschließt eine sehr kurze Passage in S-Form in seiner Mitte.  Verlängert zum Osten hin bis Lawrence, welcher eine bergige Region durchkreuzt.;;;4;Außergewöhnliche Formation;13;6 Tage nach ersterm Viertel;5 Tage nach letztem Viertel;100;100 mm Reflektor;200 mm Reflektor
RIMA CLEOMEDES;Rille;Imbrianische (Von -3.85 Mrd. bis -3.2 Mrd. Jahre) ?;Rille von Cleomedes - Cleomede;(??);Kein Name;Kein Name;Kein Name;Astronom;Griechenland;griechischer;-2;2 nd Jhd. BC;?;vers 150 BC;?;?;Autor einer Abhandlung über Astronomie in zwei, zusammengefaßt im Werk 'Theorie der Kreisbewegungen der Himmelskörper'.;56;56.0° Ost;28;28.0° Nord;Nord-Ost;Nord-West Rand von Mare Crisium;26;Cleomedes;306;;;;;60;2.5;36;2;0;0;0;Unbekannte Höhe. Kann nicht gezeigt werden.;Gelegen im Gebiet von ' Cleomedes. Orientiert in Richtung Süd-Ost Nord-West. Hat die Form eines Y. Eine Verweigung endet im Norden des kleinen Kraters Cleomedes J.;;;;4;Außergewöhnliche Formation;3;3 Tage nach Neumond;2 Tage nach Vollmond;100;100 mm Reflektor;200 mm Reflektor
RIMA CONON;Rille;Imbrianische (Von -3.85 Mrd. bis -3.2 Mrd. Jahre) ?;Rille von Conon - Conon von Samos;(??);Kein Name;Kein Name;Kein Name;Mathematiker und Astronom;Griechenland;griechischer;-4;4 . Jhd. BC;Samos;300 BC;?;?;Freund von Archimedes. Erfinder der Constellation 'Haar der Berenice'. Autor von  7 Büchern, welche die Astronomie behandeln.;2;2.0° Ost;18;18.0° Nord;Nord-Ost;Montes Apenninus Region;22;Conon;324;;;;;45;2;27;1;0;0;0;Unbekannte Höhe. Kann nicht gezeigt werden.;Geschwungene Rille, orientiert in Richtung Süd-Ost Nord-West, wo sie Sinus Fidei passiert.;;;;3;Sehr interessante Formation;7;Erstes Viertel;6 Tage nach Vollmond;150;150 mm Reflektor;300 mm Reflektor
RIMA DELISLE;Rille;Imbrianische (Von -3.85 Mrd. bis -3.2 Mrd. Jahre) ?;Rille von Delisle - Joseph Nicolas Delisle (oder Delisle der Jüngere);(??);Kein Name;Kein Name;Kein Name;Astronom;Frankreich;französischer;18;18. Jhd.;Paris;1688;Paris;1768;Mitglied der Akademie der Wissenschaften im Jahre 1714. Erfinder der Berechnung der Entfernung von Merkur und Venus mitels einen Sonnendurchganges. Fand den Platz für die Errichtung des Observatoriums von St-Petersburg.;-33;33.0° West;31;31.0° Nord;Nord-West;Noth Teil von Oceanus Procellarum;9;Mairan;358;14b7 / 16h7;;;;50;0.5;30;0;0;0;0;Unbekannte Höhe. Kann nicht gezeigt werden.;Sehr schmale und kurze, geschwungene Rille, orientiert in Richtung  Süd-West Nord-Ost.;;;;1;Wenig interessant oder schwierige Formation;10;3 Tage nach ersterm Viertel;2 Tage nach letztem Viertel;999;+ 400 mm Reflektor;+ 500 mm Reflektor
RIMA DIOPHANTUS;Rille;Imbrianische (Von -3.85 Mrd. bis -3.2 Mrd. Jahre) ?;Rille von Diophantus - Diophante;(??);Kein Name;Kein Name;Kein Name;Mathematiker;Griechenland;griechischer;3;3. Jhd. ;Alexundria;325;?;410;Wenig bekannt. Sammlung mathematischer Probleme. Arbeiten über Gleichungen erster und zweiter Ableitung.;-33;33.0° West;29;29.0° Nord;Nord-West;Region zwischen Oceanus Procellarum und Mare Imbrium;19;Brayley;359;;;;;140;0.5;85;0;0;0;0;Unbekannte Höhe. Kann nicht gezeigt werden.;Gewellte und sehr schmale Rille,  West Ost orientiert.;;;;1;Wenig interessant oder schwierige Formation;10;3 Tage nach ersterm Viertel;2 Tage nach letztem Viertel;999;+ 400 mm Reflektor;+ 500 mm Reflektor
RIMA G BOND;Rille;Imbrianische (Von -3.85 Mrd. bis -3.2 Mrd. Jahre) ?;Rille von Bond - George Philip Bond;(??);Kein Name;Kein Name;Kein Name;Astronom;U. S. A.;amerikanischer;19;19. Jhd.;?;1826;?;1865;Sohn von W. Bond. Schlug die nicht solide Nature der rings des Saturns vor und entdeckte die Natur des Orion Nebels.;35;35.0° Ost;33;33.0° Nord;Nord-Ost;Atlas Krater Süd-Ost Region;15;Atlas;311;;;;;150;3;91;2;0;0;0;Unbekannte Höhe. Kann nicht gezeigt werden.;Große Rille, orientiert in Richtung Nord Süd. Durchkreuzt einen länglichen Berg in Lacus Somniurum und schließt den Krater Hall.;;;;4;Außergewöhnliche Formation;5;5 Tage nach Neumond;4 Tage nach Vollmond;100;100 mm Reflektor;200 mm Reflektor
RIMA GALILAEI;Rille;Entstehungsperiode nicht gefunden;Rille von Galileo - Galileo Galilei (oder Galilée);(??);Kein Name;Kein Name;Kein Name;Astronom und Physiker;Italien;italienischer;17;17. Jhd.;Pise;1564;Arcetri;1642;Gründer der modernen Mechanik. Erste Nutzung eines Teleskops für Sterne. Entdeckte die Sonnenflecke, die Jupitermonde und das Mondrelief. Widerrief, daß sich die Erde um die Sonne dreht.;-59;59.0° West;13;13.0° Nord;Nord-West;Mond West Bogen;28;Galilei;258;7e8 / 8e2;;;;180;0.5;109;0;0;0;0;Unbekannte Höhe. Kann nicht gezeigt werden.;Sehr schmale, gewellte Rille, orientiert in Richtung Nord Süd. Windet sich in dem Kuppenfeld von Marius.;;1;;3;Sehr interessante Formation;12;5 Tage nach ersterm Viertel;4 Tage nach letztem Viertel;999;+ 400 mm Reflektor;+ 500 mm Reflektor
RIMA GARTNER;Rille;Entstehungsperiode nicht gefunden;Rille von Gärtner - Christian Gärtner;(??);Kein Name;Kein Name;Kein Name;Geologe;Deutschland;deutscher;18;18. Jhd.;?;1750;?;1813;??;36;36.0° Ost;65;65.0° Nord;Nord-Ost;Mond Nord-Nord-Ost Bogen;6;Strabo;369;9g2 / 10h7 / 12c7;;;;30;2;18;1;0;0;0;Unbekannte Höhe. Kann nicht gezeigt werden.;Gelegen in Gärtner. Orientiert in Richtung Süd-West Nord-Ost. Beginnt im Norden des kleinen Kraters Gärtner D. Endet bei einem gestrecktem, kleinen Krater.;;;;3;Sehr interessante Formation;5;5 Tage nach Neumond;4 Tage nach Vollmond;150;150 mm Reflektor;300 mm Reflektor
RIMA GAY-LUSSAC;Rille;Imbrianische (Von -3.85 Mrd. bis -3.2 Mrd. Jahre) ?;Rain von Gay-Lussac - Louis-Joseph Gay-Lussac;(??);Kein Name;Kein Name;Kein Name;Physiker und Chemiker;Frankreich;französischer;19;19. Jhd.;Saint-Léonard de Nob;1778;Paris;1850;Gesetz über die Ausdehnung von Gasen im Jahre 1802. Preparation des Natrium aus Potasche und vielen Säuren. Entdeckung der Halogene.;-22;22.0° West;13;13.0° Nord;Nord-West;Copernicus Krater Region;31;Copernicus;301;;;;;40;2;24;1;0;0;0;Unbekannte Höhe. Kann nicht gezeigt werden.;Süd-West Nord-Ost orientiert, gerade Rille, gelegen am Nord-West Abhang von Copernicus.;Wahrscheinlich durch die Ausrichtung kleiner Krater geformt.;;;3;Sehr interessante Formation;9;2 Tage nach ersterm Viertel;1 Tag nach Letztes Viertel;150;150 mm Reflektor;300 mm Reflektor
RIMA HADLEY;Rille;Imbrianische (Von -3.85 Mrd. bis -3.2 Mrd. Jahre) ?;Rille von Hadley - John Hadley;(??);Kein Name;Kein Name;Kein Name;Mathematiker und Physiker;England;englischer;18;18. Jhd.;Hertfordshire;1682;Ost Barnet;1744;Hersteller astronimischer Instrumente. Erfinder des Spiegelquadranten. Mitglied der Royal Society im Jahre 1717;3;3.0° Ost;25;25.0° Nord;Nord-Ost;Montes Apenninus Region;22;Conon;322;;;;;80;2.5;48;2;400;1200;0.005;Zu flach. Kann nicht gezeigt werden.;Süd-West Nord-Ost orientierte, gewellte Rille. Passiert den kleinen Krater Hadley C in seinem Zentrum. Landeplatz der Apollo 15 Mission.;;;;4;Außergewöhnliche Formation;7;Erstes Viertel;6 Tage nach Vollmond;100;100 mm Reflektor;200 mm Reflektor
